count,hate_speech,offensive_language,neither,class,tweet,tweet_clean,tweet_lemma,tweet_nouns,tweet_sym,tweet_verbs,tweet_nv,num_tokens
3,0,3,0,1,"I want my bitch to answer if my ex calling, with my dick in her mouth",i want my bitch to answer if my ex calling  with my dick in her mouth,i want -PRON- bitch to answer if -PRON- ex call   with -PRON- dick in -PRON- mouth,bitch ex dick mouth,,want answer call,bitch ex dick mouth want answer call,17
3,0,3,0,1,"I want some fire crackers not the baby ass fire works, Does Az have fire crackers ???",i want some fire crackers not the baby ass fire works  does az have fire crackers,i want some fire cracker not the baby ass fire work   do az have fire cracker,fire cracker baby fire az fire cracker,,want work,fire cracker baby fire az fire cracker want work,17
3,2,1,0,0,"I wasn't calling you a faggot, but you are one lol.",i wasn t calling you a faggot  but you are one lol,i wasn t call -PRON- a faggot   but -PRON- be one lol,wasn t faggot lol,,call,wasn t faggot lol call,13
3,2,1,0,0,"I wish faggots like @tyga would stop making music, rack city was fucking awful. Get the fuck outta michigan.",i wish faggots like mentionhere would stop making music  rack city was fucking awful  get the fuck outta michigan,i wish faggot like mentionhere would stop make music   rack city be fuck awful   get the fuck outta michigan,faggot mentionhere music rack city outta michigan,,wish would stop make fuck,faggot mentionhere music rack city outta michigan wish would stop make fuck,21
3,0,3,0,1,I won't trust a bitch &#128581;,i won t trust a bitch,i win t trust a bitch,bitch,,win trust,bitch win trust,6
3,2,1,0,0,"I wonder if that Latino strategy is working?@TPM: GOPer doubles down on ""wetbacks"" but backpedals on ""shoot on sight"" http://t.co/QwlPxxsUIb",i wonder if that latino strategy is working mentionhere  goper doubles down on  wetbacks  but backpedals on  shoot on sight  urlhere,i wonder if that latino strategy be work mentionhere   goper double down on   wetbacks   but backpedal on   shoot on sight   urlhere,strategy mentionhere goper wetbacks backpedal shoot sight,,wonder work double,strategy mentionhere goper wetbacks backpedal shoot sight wonder work double,26
3,3,0,0,0,"I would like to apologize to anyone I have called fat, stupid, gay, nigger, jew or retarded. I am truly sorry.... 

JK 

Just trolling

Fags",i would like to apologize to anyone i have called fat  stupid  gay  nigger  jew or retarded  i am truly sorry     jk just trolling fags,i would like to apologize to anyone i have call fat   stupid   gay   nigger   jew or retard   i be truly sorry      jk just troll fag,fat gay nigger jew jk fag,,would like apologize call retard troll,fat gay nigger jew jk fag would like apologize call retard troll,31
3,1,2,0,1,I''d put a bullet in that bitch...,i  d put a bullet in that bitch,i   d put a bullet in that bitch,d bullet bitch,,put,d bullet bitch put,9
3,0,3,0,1,I'd drive me crazy to have to be at that ghetto ass school everyday.,i d drive me crazy to have to be at that ghetto ass school everyday,i d drive -PRON- crazy to have to be at that ghetto ass school everyday,ghetto ass school everyday,,drive,ghetto ass school everyday drive,15
3,0,3,0,1,I'll live my life the way I want bitch,i ll live my life the way i want bitch,i will live -PRON- life the way i want bitch,life way bitch,,will live want,life way bitch will live want,10
3,0,2,1,1,I'll round up my hoes in a little bit,i ll round up my hoes in a little bit,i will round up -PRON- hoe in a little bit,hoe bit,,will round,hoe bit will round,10
3,0,3,0,1,I'm a VIPPERloid bitch:P http://t.co/tl2nfXoRSu,i m a vipperloid bitch p urlhere,i m a vipperloid bitch p urlhere,bitch p,,m,bitch p m,7
3,0,3,0,1,"I'm a dick and you ain't even got ya strap on, pussy",i m a dick and you ain t even got ya strap on  pussy,i m a dick and -PRON- ain t even get ya strap on   pussy,dick t strap pussy,,m ain get,dick t strap pussy m ain get,15
3,0,3,0,1,I'm about to hit a bitch,i m about to hit a bitch,i m about to hit a bitch,bitch,,m hit,bitch m hit,7
3,0,3,0,1,I'm about to push this niggah off my seat trying to squish me and shit,i m about to push this niggah off my seat trying to squish me and shit,i m about to push this niggah off -PRON- seat try to squish -PRON- and shit,niggah seat shit,,m push try squish,niggah seat shit m push try squish,16
3,2,1,0,0,I'm already tired and mr stupid af decides to show us a video on trigonometric notions so um yeah I just wanted to say you're a hoe,i m already tired and mr stupid af decides to show us a video on trigonometric notions so um yeah i just wanted to say you re a hoe,i m already tired and mr stupid af decide to show -PRON- a video on trigonometric notion so um yeah i just want to say -PRON- re a hoe,mr stupid af video notion hoe,,m decide show want say re,mr stupid af video notion hoe m decide show want say re,29
3,0,3,0,1,I'm bout to start singing and shit lol hoes going crazy or this nigga August,i m bout to start singing and shit lol hoes going crazy or this nigga august,i m bout to start singe and shit lol hoe go crazy or this nigga august,m bout shit lol nigga august,,start singe hoe go,m bout shit lol nigga august start singe hoe go,16
3,0,3,0,1,I'm busy what I'm tell all hoes who played me to the side .... I'M BUSY,i m busy what i m tell all hoes who played me to the side      i m busy,i m busy what i m tell all hoe who play -PRON- to the side       i m busy,hoe side,,m m tell play m,hoe side m m tell play m,19
3,1,2,0,1,I'm done wit this cheer team all these bitches are Literally BRAIN DEAD.,i m done wit this cheer team all these bitches are literally brain dead,i m do wit this cheer team all these bitch be literally brain dead,wit cheer team bitch brain,,m do,wit cheer team bitch brain m do,14
3,0,3,0,1,I'm finna quit this bitch irratating me frfr I'm sick of this shit let me start job huntin now,i m finna quit this bitch irratating me frfr i m sick of this shit let me start job huntin now,i m finna quit this bitch irratate -PRON- frfr i m sick of this shit let -PRON- start job huntin now,m finna bitch frfr shit job huntin,,quit irratate m let start,m finna bitch frfr shit job huntin quit irratate m let start,21
3,0,3,0,1,"I'm glad to see that broads are still into the ""faggot"" look when it comes to picking dudes.",i m glad to see that broads are still into the  faggot  look when it comes to picking dudes,i m glad to see that broad be still into the   faggot   look when -PRON- come to pick dude,broad faggot look dude,,m see come pick,broad faggot look dude m see come pick,21
3,2,1,0,0,"I'm going to sell my iPhone and both my Macs, I don't support faggots.",i m going to sell my iphone and both my macs  i don t support faggots,i m go to sell -PRON- iphone and both -PRON- macs   i don t support faggot,iphone macs t support faggot,,go sell don,iphone macs t support faggot go sell don,17
3,0,3,0,1,I'm just gonna get my dog to eat a bitch,i m just gonna get my dog to eat a bitch,i m just go to get -PRON- dog to eat a bitch,dog bitch,,m go eat,dog bitch m go eat,12
3,3,0,0,0,I'm just upset they got faggots on this show,i m just upset they got faggots on this show,i m just upset -PRON- get faggot on this show,faggot show,,m upset get,faggot show m upset get,10
3,2,0,1,0,"I'm literally laughing in shock, amazement, joy. In...just everything. In everything! Pop the champagne American queers. We have arrived.",i m literally laughing in shock  amazement  joy  in   just everything  in everything  pop the champagne american queers  we have arrived,i m literally laugh in shock   amazement   joy   in    just everything   in everything   pop the champagne american queer   -PRON- have arrive,shock amazement joy champagne american queer,,laugh pop arrive,shock amazement joy champagne american queer laugh pop arrive,28
3,3,0,0,0,"I'm not weird, you're just a faggot",i m not weird  you re just a faggot,i m not weird   -PRON- re just a faggot,faggot,,m re,faggot m re,10
3,2,1,0,0,I'm obviously not talking about CoD because that game is for queers.,i m obviously not talking about cod because that game is for queers,i m obviously not talk about cod because that game be for queer,cod game queer,,m talk,cod game queer m talk,13
3,2,1,0,0,I'm seeing more &amp; more niggers migrating further up liberty rd... smh,i m seeing more  amp  more niggers migrating further up liberty rd    smh,i m see more   amp   more nigger migrate further up liberty rd     smh,amp nigger liberty rd smh,,see migrate,amp nigger liberty rd smh see migrate,16
3,0,3,0,1,"I'm seventeen years old with a government job, ask me if I give two fucks about the next bitch &#128564;",i m seventeen years old with a government job  ask me if i give two fucks about the next bitch,i m seventeen year old with a government job   ask -PRON- if i give two fuck about the next bitch,m year government job fuck bitch,,ask give,m year government job fuck bitch ask give,21
3,0,3,0,1,I'm so high high high that a bitch can't blow my high,i m so high high high that a bitch can t blow my high,i m so high high high that a bitch can t blow -PRON- high,bitch high,,m can t blow,bitch high m can t blow,14
3,3,0,0,0,I'm so sick of u niggers...,i m so sick of u niggers,i m so sick of u nigger,nigger,,,nigger,7
3,0,3,0,1,I'm sorry.. I'm sorry.. I can't fuc wit u no mo hoe.. and I'm sorry &#128514;,i m sorry   i m sorry   i can t fuc wit u no mo hoe   and i m sorry,i m sorry    i m sorry    i can t fuc wit u no mo hoe    and i m sorry,wit u mo hoe,,m m can t m,wit u mo hoe m m can t m,22
3,2,1,0,0,"I'm starting to not like meek, this nig a lil to arrogant for me",i m starting to not like meek  this nig a lil to arrogant for me,i m start to not like meek   this nig a lil to arrogant for -PRON-,lil,,m start like meek,lil m start like meek,16
6,0,6,0,1,I'm such a bitch sometimes lol,i m such a bitch sometimes lol,i m such a bitch sometimes lol,bitch,,m,bitch m,7
3,2,1,0,0,I'm sure @AFP would add this helpful parenthetical explanation if these were redneck peckerwood teabaggers. https://t.co/zkqg5WfE5R,i m sure mentionhere would add this helpful parenthetical explanation if these were redneck peckerwood teabaggers  urlhere,i m sure mentionhere would add this helpful parenthetical explanation if these be redneck peckerwood teabagger   urlhere,m mentionhere explanation redneck teabagger,,would add,m mentionhere explanation redneck teabagger would add,18
3,0,3,0,1,I'm the bitch that a come out n sweats n still have Ya nigga checking for me&#128526;,i m the bitch that a come out n sweats n still have ya nigga checking for me,i m the bitch that a come out n sweat n still have ya nigga check for -PRON-,bitch come sweat nigga,,m check,bitch come sweat nigga m check,18
3,1,2,0,1,I'm thinking he has low level OCD of some sort.... That or he's just goin full retard... Pretty sure full retard,i m thinking he has low level ocd of some sort     that or he s just goin full retard    pretty sure full retard,i m think -PRON- have low level ocd of some sort      that or -PRON- s just go full retard     pretty sure full retard,level ocd sort retard retard,,m think s go,level ocd sort retard retard m think s go,25
3,0,3,0,1,I'm tryna eat steaks n dis hoe wanna eat peanuts!! -- @BIRDMAN5STAR voice,i m tryna eat steaks n dis hoe wanna eat peanuts      mentionhere voice,i m tryna eat steak n dis hoe wanna eat peanuts       mentionhere voice,m tryna steak dis hoe wanna peanuts mentionhere voice,,eat eat,m tryna steak dis hoe wanna peanuts mentionhere voice eat eat,14
3,1,2,0,1,"I've never had a problem w| anybody here, I've been w| the company for a year, and then this snitch fucking bitch is trying to get me fired",i ve never had a problem w  anybody here  i ve been w  the company for a year  and then this snitch fucking bitch is trying to get me fired,i ve never have a problem w   anybody here   i ve be w   the company for a year   and then this snitch fuck bitch be try to get -PRON- fire,problem w w company year snitch bitch,,ve ve fuck try fire,problem w w company year snitch bitch ve ve fuck try fire,34
3,0,3,0,1,Id light that bitch on fire starting with that ratchet ass weave,id light that bitch on fire starting with that ratchet ass weave,#NAME?,light bitch fire ratchet ass weave,,d start,light bitch fire ratchet ass weave d start,13
3,0,3,0,1,"Id make you look like an absolute pussy, because you're too scared to say anything to my face hahahahahaha",id make you look like an absolute pussy  because you re too scared to say anything to my face hahahahahaha,#NAME?,d pussy face hahahahahaha,,make look re say,d pussy face hahahahahaha make look re say,22
3,0,3,0,1,"If Bradley Cooper wins an #Oscar before Ryan Gosling does, imma cut a bitch.",if bradley cooper wins an hashtaghere before ryan gosling does  imma cut a bitch,if bradley cooper win an hashtaghere before ryan gosle do   imma cut a bitch,bradley cooper hashtaghere ryan imma bitch,,win gosle cut,bradley cooper hashtaghere ryan imma bitch win gosle cut,15
3,0,2,1,1,If Dj Khaled eats Nicki Minaj's pussy he finna taste everyone in the rap industry,if dj khaled eats nicki minaj s pussy he finna taste everyone in the rap industry,if dj khaled eats nicki minaj s pussy -PRON- finna taste everyone in the rap industry,dj khaled eats nicki minaj s pussy rap industry,,finna taste,dj khaled eats nicki minaj s pussy rap industry finna taste,16
6,0,6,0,1,"If I become president, everybody's on lockdown. I'm gonna run this bitch like a penitentiary.",if i become president  everybody s on lockdown  i m gonna run this bitch like a penitentiary,if i become president   everybody s on lockdown   i m go to run this bitch like a penitentiary,president lockdown m bitch penitentiary,,become s go run,president lockdown m bitch penitentiary become s go run,20
3,0,3,0,1,"If I respect you, I demand your respect back. If you think you can be a bitch, I can be an even bigger one. Bring it",if i respect you  i demand your respect back  if you think you can be a bitch  i can be an even bigger one  bring it,if i respect -PRON-   i demand -PRON- respect back   if -PRON- think -PRON- can be a bitch   i can be an even big one   bring -PRON-,respect bitch,,respect demand think can can bring,respect bitch respect demand think can can bring,30
3,0,3,0,1,"If a bitch bit my dick, I'd probably beat the shit out of her.",if a bitch bit my dick  i d probably beat the shit out of her,if a bitch bit -PRON- dick   i d probably beat the shit out of -PRON-,bitch bit dick d shit,,beat,bitch bit dick d shit beat,16
6,1,5,0,1,If a nigga in nap can fuck my bitch that mean she lame for fuckin a lame.... All deez niggas here corny asl,if a nigga in nap can fuck my bitch that mean she lame for fuckin a lame     all deez niggas here corny asl,if a nigga in nap can fuck -PRON- bitch that mean -PRON- lame for fuckin a lame      all deez niggas here corny asl,nigga nap bitch fuckin corny asl,,can fuck mean lame deez,nigga nap bitch fuckin corny asl can fuck mean lame deez,24
3,3,0,0,0,"If a spic ever talks to a white person and the white person kills them, it's self defense.",if a spic ever talks to a white person and the white person kills them  it s self defense,if a spic ever talk to a white person and the white person kill -PRON-   -PRON- s self defense,spic person person self defense,,talk kill s,spic person person self defense talk kill s,20
3,0,3,0,1,If i aint hit that bitch then i aint hit that bitch why lie about it thats petty bullshit,if i aint hit that bitch then i aint hit that bitch why lie about it thats petty bullshit,if i be not hit that bitch then i be not hit that bitch why lie about -PRON- that s petty bullshit,bitch bitch bullshit,,be hit be hit lie s,bitch bitch bullshit be hit be hit lie s,22
3,3,0,0,0,"If some one isn't an Anglo-Saxon Protestant, they have no right to be alive in the US. None at all, they are foreign filth.",if some one isn t an anglo saxon protestant  they have no right to be alive in the us  none at all  they are foreign filth,if some one isn t an anglo saxon protestant   -PRON- have no right to be alive in the us   none at all   -PRON- be foreign filth,isn t saxon right us none filth,,,isn t saxon right us none filth,29
3,3,0,0,0,If someone is part of 'James X' then he's a white trash cultist.,if someone is part of  james x  then he s a white trash cultist,if someone be part of   james x   then -PRON- s a white trash cultist,part james x trash cultist,,s,part james x trash cultist s,16
3,0,3,0,1,If u a bitch an i hadddd u i wouldnt give a fuck if Chris brown bagged u bitch i had u already lol,if u a bitch an i hadddd u i wouldnt give a fuck if chris brown bagged u bitch i had u already lol,if u a bitch an i hadddd u i would not give a fuck if chris brown bag u bitch i have u already lol,u bitch fuck chris brown u bitch,,would give bag,u bitch fuck chris brown u bitch would give bag,25
3,1,2,0,1,If u expect me to stop playin with niggas But u playin widd bitches I can't deal,if u expect me to stop playin with niggas but u playin widd bitches i can t deal,if u expect -PRON- to stop playin with niggas but u playin widd bitch i can t deal,playin niggas u playin widd bitch,,expect stop can t deal,playin niggas u playin widd bitch expect stop can t deal,18
3,2,1,0,0,If yer gonna continue to be a contrarian bitch... go die then. I've no time for such trifling!,if yer gonna continue to be a contrarian bitch    go die then  i ve no time for such trifling,if yer go to continue to be a contrarian bitch     go die then   i ve no time for such trifling,yer go bitch time trifling,,continue go die ve,yer go bitch time trifling continue go die ve,22
3,3,0,0,0,"If you kill all cops and cracker babies, what next?????? Black states, white states, and Latino states? Isn't that moving backwards?",if you kill all cops and cracker babies  what next       black states  white states  and latino states  isn t that moving backwards,if -PRON- kill all cop and cracker baby   what next        black states   white states   and latino state   isn t that move backwards,cop cracker baby black states white states latino state isn t,,kill move,cop cracker baby black states white states latino state isn t kill move,27
3,2,1,0,0,"If you say any of the following words the convo is over: nigger, nigga, swag, yolo, fag, retard.",if you say any of the following words the convo is over  nigger  nigga  swag  yolo  fag  retard,if -PRON- say any of the follow word the convo be over   nigger   nigga   swag   yolo   fag   retard,word convo nigger nigga yolo fag retard,,say follow swag,word convo nigger nigga yolo fag retard say follow swag,24
3,2,0,1,0,"If you would have followed George Washington in 1776, it means that you're white trash.",if you would have followed george washington in   it means that you re white trash,if -PRON- would have follow george washington in    -PRON- mean that -PRON- re white trash,george washington white trash,,would follow mean re,george washington white trash would follow mean re,16
3,0,3,0,1,"If you're a whiney bitch, have a ZIMA and shut the fuck up! 
#Democrats http://t.co/ZAYMXsdza3",if you re a whiney bitch  have a zima and shut the fuck up  hashtaghere urlhere,if -PRON- re a whiney bitch   have a zima and shut the fuck up   hashtaghere urlhere,whiney bitch zima fuck,,re shut,whiney bitch zima fuck re shut,18
3,1,2,0,1,"If your a nigga ... And you use the term "" yassssssssss "" im just gonna assume your a fag",if your a nigga     and you use the term   yassssssssss   im just gonna assume your a fag,if -PRON- a nigga      and -PRON- use the term    yassssssssss    -PRON- be just go to assume -PRON- a fag,nigga term yassssssssss fag,,use be go assume,nigga term yassssssssss fag use be go assume,22
3,0,3,0,1,Im about to get all the pussy.,im about to get all the pussy,#NAME?,pussy,,be,pussy be,8
3,1,2,0,1,"Im married to a retard, must be why we're so good together. Nigga hunching me in his sleep.",im married to a retard  must be why we re so good together  nigga hunching me in his sleep,#NAME?,nigga sleep,,be marry must re hunching,nigga sleep be marry must re hunching,22
3,0,3,0,1,Im prolly wit yo bitch big butt cant fit up in the 6!,im prolly wit yo bitch big butt cant fit up in the,#NAME?,wit yo bitch butt,,be can fit,wit yo bitch butt be can fit,14
3,2,1,0,0,Im soooooo tired of this dick dyke showing up on my fb feed. Real studs dont fucc niggas. Just be bisexual.,im soooooo tired of this dick dyke showing up on my fb feed  real studs dont fucc niggas  just be bisexual,#NAME?,soooooo dick dyke fb feed stud,,be show fucc niggas,soooooo dick dyke fb feed stud be show fucc niggas,25
6,1,5,0,1,Im start askin dese hoe niggas if they got sand in they pussy....,im start askin dese hoe niggas if they got sand in they pussy,#NAME?,askin dese sand,,be start hoe get,askin dese sand be start hoe get,14
3,0,3,0,1,Im the biggest pussy when it comes to scary stuff,im the biggest pussy when it comes to scary stuff,#NAME?,pussy stuff,,be come,pussy stuff be come,11
6,0,6,0,1,"Im way out of your league hoe, please excuse my ego",im way out of your league hoe  please excuse my ego,#NAME?,way league hoe ego,,be excuse,way league hoe ego be excuse,13
3,0,3,0,1,Imma limit my association with these grade f bitches next year on my life just gone be me and a few ppl don't got time for the BS frfr,imma limit my association with these grade f bitches next year on my life just gone be me and a few ppl don t got time for the bs frfr,imma limit -PRON- association with these grade f bitch next year on -PRON- life just go be -PRON- and a few ppl don t get time for the bs frfr,imma limit association grade f bitch year life ppl don t time bs frfr,,go get,imma limit association grade f bitch year life ppl don t time bs frfr go get,30
3,0,3,0,1,"In a movie, everybody ain't the star... Need Co stars and extras... &#171;@ChanteGooden I hate hoes that take pride in being the other chick&#187;",in a movie  everybody ain t the star    need co stars and extras       mentionhere i hate hoes that take pride in being the other chick,in a movie   everybody ain t the star     need co star and extras        mentionhere i hate hoe that take pride in be the other chick,movie t star co star extras mentionhere pride chick,,ain need hate hoe take,movie t star co star extras mentionhere pride chick ain need hate hoe take,28
3,1,2,0,1,"In my opinion LHHA is a spot on description of how some of Atlanta is. Dumb hoes and niggas, ratchet broads, and stupid arguments.",in my opinion lhha is a spot on description of how some of atlanta is  dumb hoes and niggas  ratchet broads  and stupid arguments,in -PRON- opinion lhha be a spot on description of how some of atlanta be   dumb hoe and niggas   ratchet broad   and stupid argument,opinion lhha spot description atlanta hoe niggas ratchet argument,,broad,opinion lhha spot description atlanta hoe niggas ratchet argument broad,27
3,0,3,0,1,"In the words of lil Debbie ""I'm that bitch""",in the words of lil debbie  i m that bitch,in the word of lil debbie   i m that bitch,word lil debbie i bitch,,m,word lil debbie i bitch m,11
3,0,3,0,1,"Instagram have you looking at motherfuckers like ""Who the FUCK does this bitch/nigga think she/he ISSS""??",instagram have you looking at motherfuckers like  who the fuck does this bitch nigga think she he isss,instagram have -PRON- look at motherfucker like   who the fuck do this bitch nigga think -PRON- -PRON- iss,instagram motherfucker fuck bitch nigga,,look think iss,instagram motherfucker fuck bitch nigga look think iss,19
3,2,1,0,0,Ion care fuck that hoe &#9996;&#65039;,ion care fuck that hoe,ion care fuck that hoe,ion care fuck,,hoe,ion care fuck hoe,5
3,0,3,0,1,Iont got no type NAW bad bitches is the only thing that I like,iont got no type naw bad bitches is the only thing that i like,iont get no type naw bad bitch be the only thing that i like,iont type naw bitch thing,,get like,iont type naw bitch thing get like,14
3,3,0,0,0,Iont see how some of you niggas fags!!,iont see how some of you niggas fags,iont see how some of -PRON- niggas fag,iont fag,,see,iont fag see,8
3,2,1,0,0,Is there a full moon out? #CrazyAssholes out in full force and I'm not talking about muzzies or liberals&#8252;&#65039; And I'm in the mood to oblige.,is there a full moon out  hashtaghere out in full force and i m not talking about muzzies or liberals       and i m in the mood to oblige,be there a full moon out   hashtaghere out in full force and i m not talk about muzzie or liberal        and i m in the mood to oblige,moon force muzzie liberal mood,,m talk oblige,moon force muzzie liberal mood m talk oblige,30
3,2,0,1,0,"It happens AGAIN!! Black pack beats ""whitey."" This should make national news. http://t.co/izKoA2Xb",it happens again   black pack beats  whitey   this should make national news  urlhere,#NAME?,pack whitey news,,happen beat should make,pack whitey news happen beat should make,17
3,0,3,0,1,"It is impossible for females to be players, pimps, etc... They're called hoes",it is impossible for females to be players  pimps  etc    they re called hoes,#NAME?,female player pimp hoe,,re call,female player pimp hoe re call,17
3,0,3,0,1,It pissrs me tf off when I call you back a half a second later nd you dont answer. You a bitch ass nigga for that,it pissrs me tf off when i call you back a half a second later nd you dont answer  you a bitch ass nigga for that,#NAME?,tf half nd bitch ass nigga,,pissr call answer,tf half nd bitch ass nigga pissr call answer,28
3,2,1,0,0,It really is too bad that #California had faggot marriage forced upon her after her citizens declared it illegal.,it really is too bad that hashtaghere had faggot marriage forced upon her after her citizens declared it illegal,#NAME?,faggot marriage citizen,,force declare,faggot marriage citizen force declare,19
