count,hate_speech,offensive_language,neither,class,tweet,tweet_clean,tweet_lemma,tweet_nouns,tweet_sym,tweet_verbs,tweet_nv,num_tokens
3,0,3,0,1,RT @Randall_Jayy: &#8220;@_100D: I got hard dick for all dez bitches. I get all they numbers I don't call dez bitches.&#8221; LMAO RT,rt mentionhere     mentionhere  i got hard dick for all dez bitches  i get all they numbers i don t call dez bitches     lmao rt,rt mentionhere      mentionhere   i get hard dick for all dez bitch   i get all -PRON- number i don t call dez bitches      lmao rt,rt mentionhere mentionhere dick dez t call dez bitches lmao rt,,get bitch get number don,rt mentionhere mentionhere dick dez t call dez bitches lmao rt get bitch get number don,28
3,0,3,0,1,"RT @RawstonGeorge: &#8220;@distilled9water: ""@wizzyjr https://t.co/OtZ0FGDVpR &#128557;&#128557;&#128557;&#128557;&#128557;&#128557;&#8221; bitch gotta die 10,000 deaths. &#128534;&#128557;&#8221; &#128557;&#128557;&#128557;&#128557;&#128557;&#128557;&#128557; GTFOH",rt mentionhere     mentionhere   mentionhere urlhere                       bitch gotta die   deaths                                  gtfoh,rt mentionhere      mentionhere    mentionhere urlhere                        bitch get to die    death                                   gtfoh,rt mentionhere mentionhere urlhere bitch death gtfoh,,mentionhere get die,rt mentionhere mentionhere urlhere bitch death gtfoh mentionhere get die,16
3,0,3,0,1,"RT @RayIopez: ""make me ur wcw""

""how many girls do u talk to""

""am I ur side hoe""

""tweet about me so I know it's real"" http://t.co/LB274Gh&#8230;",rt mentionhere   make me ur wcw   how many girls do u talk to   am i ur side hoe   tweet about me so i know it s real  urlhere,rt mentionhere    make -PRON- ur wcw    how many girl do u talk to    be i ur side hoe    tweet about -PRON- so i know -PRON- s real   urlhere,rt mentionhere girl ur side tweet,,make talk hoe know s,rt mentionhere girl ur side tweet make talk hoe know s,33
3,0,3,0,1,RT @RealErik_95: Don't worry about my old bitch or my next bitch,rt mentionhere  don t worry about my old bitch or my next bitch,rt mentionhere   don t worry about -PRON- old bitch or -PRON- next bitch,rt mentionhere don t worry bitch bitch,,,rt mentionhere don t worry bitch bitch,14
3,0,3,0,1,"RT @RealSexNotes: Too many faithful girls are single, and too many hoes are taken.",rt mentionhere  too many faithful girls are single  and too many hoes are taken,rt mentionhere   too many faithful girl be single   and too many hoe be take,rt mentionhere girl hoe,,take,rt mentionhere girl hoe take,16
3,1,2,0,1,RT @ReevesJunya: bitch ass niggas claim to be yo homies then get on dirt .. All bitch ass niggaa can die slow,rt mentionhere  bitch ass niggas claim to be yo homies then get on dirt    all bitch ass niggaa can die slow,rt mentionhere   bitch ass niggas claim to be yo homie then get on dirt     all bitch ass niggaa can die slow,rt mentionhere bitch ass claim yo homie dirt bitch ass niggaa,,can die,rt mentionhere bitch ass claim yo homie dirt bitch ass niggaa can die,23
3,0,3,0,1,RT @RhineRunIt: Henny &amp; hoes. RT @TiFFANY_P0RSCHE: Peace &amp; tranquillity &#8220;@daddykn0wsbest: If you were a Greek Mythical God&#8230;what would u be &#8230;,rt mentionhere  henny  amp  hoes  rt mentionhere  peace  amp  tranquillity    mentionhere  if you were a greek mythical god   what would u be,rt mentionhere   henny   amp   hoe   rt mentionhere   peace   amp   tranquillity     mentionhere   if -PRON- be a greek mythical god    what would u be,rt mentionhere henny amp rt mentionhere peace amp tranquillity mentionhere mythical god,,hoe would,rt mentionhere henny amp rt mentionhere peace amp tranquillity mentionhere mythical god hoe would,32
3,0,2,1,1,"RT @RickNothing: I love how ""twat"" is gender neutral.",rt mentionhere  i love how  twat  is gender neutral,rt mentionhere   i love how   twat   be gender neutral,rt mentionhere twat gender,,love,rt mentionhere twat gender love,12
3,2,1,0,0,RT @Ride907: If some little fucking faggot spits in my food I swear to god id tear your fucking arms off http://t.co/EQociANZ77,rt mentionhere  if some little fucking faggot spits in my food i swear to god id tear your fucking arms off urlhere,rt mentionhere   if some little fucking faggot spit in -PRON- food i swear to god -PRON- d tear -PRON- fucking arm off urlhere,rt mentionhere faggot spit food god arm,,swear d tear,rt mentionhere faggot spit food god arm swear d tear,24
3,2,1,0,0,RT @RihannaHasAids: aight game over. dykes had to ruin it http://t.co/o0CAn6gb1p,rt mentionhere  aight game over  dykes had to ruin it urlhere,rt mentionhere   aight game over   dyke have to ruin -PRON- urlhere,rt mentionhere aight game,,dyke ruin,rt mentionhere aight game dyke ruin,13
6,0,6,0,1,RT @RmpHarris: I kinda miss tremper I use to be threw dat bitch lol Never in class lmao,rt mentionhere  i kinda miss tremper i use to be threw dat bitch lol never in class lmao,rt mentionhere   i kinda miss tremper i use to be throw dat bitch lol never in class lmao,rt mentionhere kinda miss tremper dat bitch lol class lmao,,use throw,rt mentionhere kinda miss tremper dat bitch lol class lmao use throw,19
3,0,3,0,1,RT @Rob_San9993: @214bighappy that bitch was looking for anything to go up her ass!..haha,rt mentionhere  mentionhere that bitch was looking for anything to go up her ass   haha,rt mentionhere   mentionhere that bitch be look for anything to go up -PRON- ass    haha,rt mentionhere mentionhere bitch ass,,look go,rt mentionhere mentionhere bitch ass look go,17
3,1,2,0,1,RT @Rock76_: just show im not playing in this bitch one false move ima spraying in this bitch @1waynostra,rt mentionhere  just show im not playing in this bitch one false move ima spraying in this bitch mentionhere,rt mentionhere   just show -PRON- be not play in this bitch one false move -PRON- be going to spraying in this bitch mentionhere,rt mentionhere bitch move be going to spraying bitch mentionhere,,show be play,rt mentionhere bitch move be going to spraying bitch mentionhere show be play,23
3,3,0,0,0,"RT @RollingWithTrin: ""1, 2, 3, 4, how many niggers are in my store? I knowwww you're stealing!"" &#128514;&#128514;&#128514;",rt mentionhere           how many niggers are in my store  i knowwww you re stealing,rt mentionhere            how many nigger be in -PRON- store   i knowwww -PRON- re steal,rt mentionhere nigger store,,knowwww re steal,rt mentionhere nigger store knowwww re steal,16
3,0,3,0,1,"RT @RonTheAnchorman: a girl tweeted ""you might be ghetto if u bring food from outside into the movies""

no u might be stupid if u pay 4.99 &#8230;",rt mentionhere  a girl tweeted  you might be ghetto if u bring food from outside into the movies  no u might be stupid if u pay,rt mentionhere   a girl tweet   -PRON- may be ghetto if u bring food from outside into the movie   no u may be stupid if u pay,rt mentionhere girl food movie u,,tweet may bring may pay,rt mentionhere girl food movie u tweet may bring may pay,29
3,2,1,0,0,RT @RosieZaya1: Ur fucking white trash,rt mentionhere  ur fucking white trash,rt mentionhere   ur fuck white trash,rt mentionhere ur trash,,fuck,rt mentionhere ur trash fuck,7
3,2,1,0,0,RT @SAMMI_boyden: Fucking James tried to tell me Jawga Boys sucked. I went ape shit dude @savanigga @OfficialDThrash @jawgaboyz,rt mentionhere  fucking james tried to tell me jawga boys sucked  i went ape shit dude mentionhere mentionhere mentionhere,rt mentionhere   fucking james try to tell -PRON- jawga boy suck   i go ape shit dude mentionhere mentionhere mentionhere,rt mentionhere fucking james jawga boy ape shit dude mentionhere mentionhere mentionhere,,try tell suck go,rt mentionhere fucking james jawga boy ape shit dude mentionhere mentionhere mentionhere try tell suck go,21
3,0,3,0,1,"RT @SFsneeejayy: Bitch hmu say she need sex right now, bitch nigga hmu saying he upset right now",rt mentionhere  bitch hmu say she need sex right now  bitch nigga hmu saying he upset right now,rt mentionhere   bitch hmu say -PRON- need sex right now   bitch nigga hmu say -PRON- upset right now,rt mentionhere bitch hmu sex bitch nigga hmu,,say need say upset,rt mentionhere bitch hmu sex bitch nigga hmu say need say upset,20
3,2,1,0,0,RT @STROCORLEONE @ThoughtsOfRandy @Yummys_World all deze hoes got past demons in em... YOLO nigga lol + Hahahahaha,rt mentionhere mentionhere mentionhere all deze hoes got past demons in em    yolo nigga lol   hahahahaha,rt mentionhere mentionhere mentionhere all deze hoe get past demon in -PRON-     yolo nigga lol    hahahahaha,rt mentionhere mentionhere mentionhere deze hoe demon nigga lol hahahahaha,,get,rt mentionhere mentionhere mentionhere deze hoe demon nigga lol hahahahaha get,18
6,4,2,0,0,"RT @SUCKEDOFF: 3 MOST COMMON WHITE PEOPLE ACTIVITIES:

1. Wearing Tapout

2. Shooting up schools

3. Calling you a nigger on Xbox",rt mentionhere   most common white people activities    wearing tapout   shooting up schools   calling you a nigger on xbox,rt mentionhere    most common white people activity     wear tapout    shoot up school    call -PRON- a nigger on xbox,rt mentionhere people activity tapout school nigger xbox,,wear shoot call,rt mentionhere people activity tapout school nigger xbox wear shoot call,22
3,0,3,0,1,"RT @Salaayah: ""I let ma chain hang low...""
""Two chains...""
""Gold all in ma chain...""
""I keep a chain ana hoe...""
""Niggas staring at ma chai&#8230;",rt mentionhere   i let ma chain hang low      two chains      gold all in ma chain      i keep a chain ana hoe      niggas staring at ma chai,rt mentionhere    i let ma chain hang low       two chain       gold all in ma chain       i keep a chain ana hoe       niggas stare at ma chai,rt mentionhere ma chain chain gold ma chain chain ana hoe niggas ma chai,,let hang keep stare,rt mentionhere ma chain chain gold ma chain chain ana hoe niggas ma chai let hang keep stare,31
3,2,0,1,0,RT @SalamanCode: Proof that thots are retarded. http://t.co/rHJSlL9i9f,rt mentionhere  proof that thots are retarded  urlhere,rt mentionhere   proof that thot be retarded   urlhere,rt mentionhere proof thot,,,rt mentionhere proof thot,10
3,2,1,0,0,"RT @SalomaeSadiqa: It's because you can't bend me, you can't buy me and you can't make me into your nigger! #Farrakhan #TheTime",rt mentionhere  it s because you can t bend me  you can t buy me and you can t make me into your nigger  hashtaghere hashtaghere,rt mentionhere   -PRON- s because -PRON- can t bend -PRON-   -PRON- can t buy -PRON- and -PRON- can t make -PRON- into -PRON- nigger   hashtaghere hashtaghere,rt mentionhere nigger,,s can t bend can t buy can t make,rt mentionhere nigger s can t bend can t buy can t make,29
3,2,0,1,0,RT @Sam_James3: @will123_william @haydenhill13 @aknadnrye @khalilreed I don't care tho cracker,rt mentionhere  mentionhere mentionhere mentionhere mentionhere i don t care tho cracker,rt mentionhere   mentionhere mentionhere mentionhere mentionhere i don t care tho cracker,rt mentionhere mentionhere mentionhere mentionhere mentionhere t tho cracker,,don care,rt mentionhere mentionhere mentionhere mentionhere mentionhere t tho cracker don care,13
3,2,1,0,0,RT @SeanPrice: This nigger tattoo show is horrible,rt mentionhere  this nigger tattoo show is horrible,rt mentionhere   this nigger tattoo show be horrible,rt mentionhere nigger tattoo show,,,rt mentionhere nigger tattoo show,9
3,3,0,0,0,"RT @Seymor_Buccs: Man, most of you coons couldn't jus up in quit yo job, if you found out ya boss racist, so shut tha fucc up. Niggas love &#8230;",rt mentionhere  man  most of you coons couldn t jus up in quit yo job  if you found out ya boss racist  so shut tha fucc up  niggas love,rt mentionhere   man   most of -PRON- coon couldn t jus up in quit yo job   if -PRON- find out ya boss racist   so shut tha fucc up   niggas love,rt mentionhere man coon couldn t jus quit yo job ya boss racist shut tha niggas love,,find fucc,rt mentionhere man coon couldn t jus quit yo job ya boss racist shut tha niggas love find fucc,34
3,0,3,0,1,RT @ShanTaughtUwell: Never trust a bitch that try to be a side bitch,rt mentionhere  never trust a bitch that try to be a side bitch,rt mentionhere   never trust a bitch that try to be a side bitch,rt mentionhere bitch side bitch,,trust try,rt mentionhere bitch side bitch trust try,14
3,0,3,0,1,RT @SheScreamsGera: Stop complaining about being single hoe! We have bigger problems here Rn Like McDonald&#8217;s doesn&#8217;t serve breakfast after &#8230;,rt mentionhere  stop complaining about being single hoe  we have bigger problems here rn like mcdonald   s doesn   t serve breakfast after,rt mentionhere   stop complain about be single hoe   -PRON- have big problem here rn like mcdonald    s doesn    t serve breakfast after,rt mentionhere hoe problem mcdonald s doesn t breakfast,,stop complain rn serve,rt mentionhere hoe problem mcdonald s doesn t breakfast stop complain rn serve,26
3,0,3,0,1,RT @SirTweak_Alot: Duncanville girls cold den a hoe,rt mentionhere  duncanville girls cold den a hoe,rt mentionhere   duncanville girls cold den a hoe,rt mentionhere duncanville girls den hoe,,,rt mentionhere duncanville girls den hoe,9
3,2,1,0,0,"RT @Slanguage: Stop flattering yourself, bitch. The only fan you have is on your ceiling.",rt mentionhere  stop flattering yourself  bitch  the only fan you have is on your ceiling,rt mentionhere   stop flatter -PRON-   bitch   the only fan -PRON- have be on -PRON- ceiling,rt mentionhere bitch fan ceiling,,stop flatter,rt mentionhere bitch fan ceiling stop flatter,18
3,0,3,0,1,RT @SlimGirl_Probz: &#8220;@TRESHON_SCROOGE: Oomf pregnant from dat dog in the hood dat chase erbody &#128514;&#128514;&#128514;&#8221;REAL funny bitch!!!!,rt mentionhere     mentionhere  oomf pregnant from dat dog in the hood dat chase erbody             real funny bitch,rt mentionhere      mentionhere   oomf pregnant from dat dog in the hood dat chase erbody              real funny bitch,rt mentionhere mentionhere dat dog hood dat chase erbody bitch,,oomf,rt mentionhere mentionhere dat dog hood dat chase erbody bitch oomf,20
3,0,3,0,1,"RT @Slutty_Hermione: Twerking in the chamber of secrets, with all my bad bitches #twerkteam",rt mentionhere  twerking in the chamber of secrets  with all my bad bitches hashtaghere,rt mentionhere   twerking in the chamber of secret   with all -PRON- bad bitch hashtaghere,rt mentionhere twerking chamber secret bitch,,,rt mentionhere twerking chamber secret bitch,16
3,1,2,0,1,RT @Smokinonkaya_: She said I hurt her feelings now she dating dykes..,rt mentionhere  she said i hurt her feelings now she dating dykes,rt mentionhere   -PRON- say i hurt -PRON- feeling now -PRON- date dyke,rt mentionhere feeling,,say hurt date dyke,rt mentionhere feeling say hurt date dyke,13
3,2,1,0,0,RT @SnipersInPeril: @ShinSnipes happy birthday my little cotton picker,rt mentionhere  mentionhere happy birthday my little cotton picker,rt mentionhere   mentionhere happy birthday -PRON- little cotton picker,rt mentionhere mentionhere birthday cotton picker,,,rt mentionhere mentionhere birthday cotton picker,10
3,2,1,0,0,"RT @SnowThaProduct: i can do somethin good but im always gon be a ""wetback"" coo.. &#9996;",rt mentionhere  i can do somethin good but im always gon be a  wetback  coo,rt mentionhere   i can do something good but -PRON- be always gon be a   wetback   coo,rt mentionhere something gon wetback coo,,can be,rt mentionhere something gon wetback coo can be,19
3,0,3,0,1,RT @Somaya_Reece: I am nice I am humble but I will still let a bitch know what's up! HUNNNNEY&#128133;&#128226;&#128226;&#128226;&#128226;&#128226;,rt mentionhere  i am nice i am humble but i will still let a bitch know what s up  hunnnney,rt mentionhere   i be nice i be humble but i will still let a bitch know what s up   hunnnney,rt mentionhere bitch hunnnney,,will let know s,rt mentionhere bitch hunnnney will let know s,22
3,0,3,0,1,"RT @SouthPark: &#8220;If you want to buy anything, you just talk to the bottom bitch and then the bottom bitch talks to me&#8230; Do you know what I am&#8230;",rt mentionhere     if you want to buy anything  you just talk to the bottom bitch and then the bottom bitch talks to me    do you know what i am,rt mentionhere      if -PRON- want to buy anything   -PRON- just talk to the bottom bitch and then the bottom bitch talk to -PRON-     do -PRON- know what i be,rt mentionhere bottom bitch bitch talk,,want buy talk know,rt mentionhere bottom bitch bitch talk want buy talk know,32
3,1,2,0,1,RT @Spartacunt: I should get a job at the USPS customer service number since the only requirement is being a total cunt.,rt mentionhere  i should get a job at the usps customer service number since the only requirement is being a total cunt,rt mentionhere   i should get a job at the usps customer service number since the only requirement be be a total cunt,rt mentionhere job usps customer service number requirement cunt,,should,rt mentionhere job usps customer service number requirement cunt should,23
3,0,3,0,1,RT @SteadmanTerri: @wheeler_kashhh bitch waaaaaa??,rt mentionhere  mentionhere bitch waaaaaa,rt mentionhere   mentionhere bitch waaaaaa,rt mentionhere mentionhere bitch,,,rt mentionhere mentionhere bitch,6
6,0,5,1,1,RT @StephenGoetz2: These hoes ain't loyal,rt mentionhere  these hoes ain t loyal,rt mentionhere   these hoe ain t loyal,rt mentionhere hoe t,,ain,rt mentionhere hoe t ain,8
3,0,2,1,1,"RT @SteveStfler: ""Stop talking ghetto, you're white"" http://t.co/WZbDbi0f9k",rt mentionhere   stop talking ghetto  you re white  urlhere,rt mentionhere    stop talk ghetto   -PRON- re white   urlhere,rt mentionhere ghetto,,stop talk re,rt mentionhere ghetto stop talk re,12
3,2,1,0,0,"RT @SteveStfler: ur a faggot if you change your name to your bday just so you can get bday tweets. this aint FB nigga, fuck yo birthday",rt mentionhere  ur a faggot if you change your name to your bday just so you can get bday tweets  this aint fb nigga  fuck yo birthday,rt mentionhere   ur a faggot if -PRON- change -PRON- name to -PRON- bday just so -PRON- can get bday tweet   this be not fb nigga   fuck yo birthday,rt mentionhere faggot name bday bday tweet fb nigga fuck yo birthday,,change can be,rt mentionhere faggot name bday bday tweet fb nigga fuck yo birthday change can be,31
3,0,3,0,1,RT @StoppaOnline: so many groupie hoes in the condo its a group home - @KirkoBangz,rt mentionhere  so many groupie hoes in the condo its a group home   mentionhere,rt mentionhere   so many groupie hoe in the condo -PRON- a group home    mentionhere,rt mentionhere groupie condo group home mentionhere,,hoe,rt mentionhere groupie condo group home mentionhere hoe,16
3,0,3,0,1,RT @StormyDaniels: I know another chick I will NEVER shoot again. Filing this one under: heartless cunt,rt mentionhere  i know another chick i will never shoot again  filing this one under  heartless cunt,rt mentionhere   i know another chick i will never shoot again   file this one under   heartless cunt,rt mentionhere chick heartless cunt,,know will shoot file,rt mentionhere chick heartless cunt know will shoot file,20
6,5,1,0,0,RT @SwaaggyyV: Fucking chinks in Clash of Clans always fuck me up. Bitch ass kamikaze faggots.,rt mentionhere  fucking chinks in clash of clans always fuck me up  bitch ass kamikaze faggots,rt mentionhere   fucking chink in clash of clan always fuck -PRON- up   bitch ass kamikaze faggot,rt mentionhere chink clash clan bitch ass kamikaze faggot,,fuck,rt mentionhere chink clash clan bitch ass kamikaze faggot fuck,18
3,0,2,1,1,RT @Swishas_Erbs: &#8220;@Vonteeeeee: 90% of the black girls at my school are ghetto AF&#8221; 98.6%,rt mentionhere     mentionhere    of the black girls at my school are ghetto af,rt mentionhere      mentionhere     of the black girl at -PRON- school be ghetto af,rt mentionhere mentionhere girl school ghetto,,,rt mentionhere mentionhere girl school ghetto,15
3,0,3,0,1,RT @TAXSTONE: If YA bitch ex is a nigga u think is lame u might be lame for having a lame nigga old bitch,rt mentionhere  if ya bitch ex is a nigga u think is lame u might be lame for having a lame nigga old bitch,rt mentionhere   if ya bitch ex be a nigga u think be lame u may be lame for have a lame nigga old bitch,rt mentionhere ya bitch ex nigga u u nigga bitch,,think may have,rt mentionhere ya bitch ex nigga u u nigga bitch think may have,25
3,2,1,0,0,RT @TAXSTONE: Niggaz like all them naked bitches on IG pics NIGGAZ DONT LOVE EM,rt mentionhere  niggaz like all them naked bitches on ig pics niggaz dont love em,rt mentionhere   niggaz like all -PRON- naked bitch on ig pic niggaz do not love -PRON-,rt mentionhere niggaz bitch ig pic niggaz,,love,rt mentionhere niggaz bitch ig pic niggaz love,17
6,0,6,0,1,RT @TAXSTONE: These bitches self esteem built off likes and their principles built off Instagram memes,rt mentionhere  these bitches self esteem built off likes and their principles built off instagram memes,rt mentionhere   these bitch self esteem build off like and -PRON- principle build off instagram meme,rt mentionhere bitch self esteem like principle instagram meme,,build build,rt mentionhere bitch self esteem like principle instagram meme build build,17
6,0,6,0,1,RT @TAXSTONE: Y'all bitches got to learn the difference between like and love,rt mentionhere  y all bitches got to learn the difference between like and love,rt mentionhere   y all bitch get to learn the difference between like and love,rt mentionhere y bitch difference like love,,get learn,rt mentionhere y bitch difference like love get learn,15
3,0,3,0,1,"RT @TAXSTONE: You dumb bitches still think pretty is everything ""KERI LOOKS BETTER THAN BEYONC&#201; "" Keri probably know she do too but guess &#8230;",rt mentionhere  you dumb bitches still think pretty is everything  keri looks better than beyonc      keri probably know she do too but guess,rt mentionhere   -PRON- dumb bitch still think pretty be everything   keri look well than beyonc       keri probably know -PRON- do too but guess,rt mentionhere bitch keri beyonc keri,,think look know guess,rt mentionhere bitch keri beyonc keri think look know guess,26
3,0,3,0,1,RT @TMRoja: I'm all cock and pussy like in my tweets; and all penis and vagina like in DMs &#128586;,rt mentionhere  i m all cock and pussy like in my tweets  and all penis and vagina like in dms,rt mentionhere   i m all cock and pussy like in -PRON- tweet   and all penis and vagina like in dms,rt mentionhere m cock pussy tweet penis vagina dms,,,rt mentionhere m cock pussy tweet penis vagina dms,22
3,0,3,0,1,"RT @TRU_Realigion_: Let a bitch try me try me, Ima swing her to the whole mf family &#128080;&#128514;",rt mentionhere  let a bitch try me try me  ima swing her to the whole mf family,rt mentionhere   let a bitch try -PRON- try -PRON-   -PRON- be going to swing -PRON- to the whole mf family,rt mentionhere bitch swing whole mf family,,let try try be,rt mentionhere bitch swing whole mf family let try try be,21
3,0,3,0,1,"RT @T_ElMarauder: So when the clock hits 12 o'clock imma need the baddest, lightest, &amp; brightest hoes to be at @WhatsAshirt door. Give my b&#8230;",rt mentionhere  so when the clock hits  o clock imma need the baddest  lightest   amp  brightest hoes to be at mentionhere door  give my b,rt mentionhere   so when the clock hit   o clock imma need the badd   light    amp   bright hoe to be at mentionhere door   give -PRON- b,rt mentionhere clock o clock imma amp hoe mentionhere door b,,hit need give,rt mentionhere clock o clock imma amp hoe mentionhere door b hit need give,31
3,0,3,0,1,"RT @TacoRell Stressed backwards is ""Desserts"" that's why bitches eat junk food when depressed",rt mentionhere stressed backwards is  desserts  that s why bitches eat junk food when depressed,rt mentionhere stress backward be   dessert   that s why bitch eat junk food when depress,rt mentionhere backward dessert s bitch junk food,,stress eat depress,rt mentionhere backward dessert s bitch junk food stress eat depress,17
3,3,0,0,0,RT @Tae_Rhodes: &#8220;@kim92493: &#8220;@Tae_Rhodes: @kim92493 @patpatbush uhhh you've been judged&#8221; it happens. #whitepower...I'll hang you nigger&#8221; wo&#8230;,rt mentionhere     mentionhere     mentionhere  mentionhere mentionhere uhhh you ve been judged    it happens  hashtaghere   i ll hang you nigger    wo,rt mentionhere      mentionhere      mentionhere   mentionhere mentionhere uhhh -PRON- ve be judge     -PRON- happen   hashtaghere    i will hang -PRON- nigger     wo,rt mentionhere mentionhere mentionhere mentionhere mentionhere nigger,,ve judge happen will hang,rt mentionhere mentionhere mentionhere mentionhere mentionhere nigger ve judge happen will hang,27
3,2,1,0,0,RT @TankTopshotta: A real nigga gone teach his bitch the game not run it on her &#128582;&#128130;&#128520;,rt mentionhere  a real nigga gone teach his bitch the game not run it on her,rt mentionhere   a real nigga go teach -PRON- bitch the game not run -PRON- on -PRON-,rt mentionhere nigga bitch game,,go teach run,rt mentionhere nigga bitch game go teach run,17
3,2,1,0,0,RT @Tease: RT or you're a fag. http://t.co/4Ol82rdeqX,rt mentionhere  rt or you re a fag  urlhere,rt mentionhere   rt or -PRON- re a fag   urlhere,rt mentionhere rt fag,,re,rt mentionhere rt fag re,11
3,2,1,0,0,"RT @ThatBajanKidd: #NeverAskABlackPerson if her hair is hers . she will hit you with a ""bitch i bought it , so it's mine"" .",rt mentionhere  hashtaghere if her hair is hers   she will hit you with a  bitch i bought it   so it s mine,rt mentionhere   hashtaghere if -PRON- hair be hers    -PRON- will hit -PRON- with a   bitch i buy -PRON-    so -PRON- s mine,rt mentionhere hair bitch mine,,will hit buy s,rt mentionhere hair bitch mine will hit buy s,26
