count,hate_speech,offensive_language,neither,class,tweet,tweet_clean,tweet_lemma,tweet_nouns,tweet_sym,tweet_verbs,tweet_nv,num_tokens
3,1,2,0,1,""" bitch who do you love """,bitch who do you love,bitch who do -PRON- love,bitch,,love,bitch love,5
3,0,3,0,1,""" fuck no that bitch dont even suck dick "" &#128514;&#128514;&#128514; the Kermit videos bout to fuck IG up",fuck no that bitch dont even suck dick             the kermit videos bout to fuck ig up,fuck no that bitch do not even suck dick              the kermit video bout to fuck ig up,bitch dick kermit video bout,,suck fuck,bitch dick kermit video bout suck fuck,18
3,0,2,1,1,""" lames crying over hoes thats tears of a clown """,lames crying over hoes thats tears of a clown,lame cry over hoe that s tear of a clown,lame hoe tear clown,,cry s,lame hoe tear clown cry s,10
3,0,3,0,1,"""..All I wanna do is get money and fuck model bitches!"" - Russell Simmons",all i wanna do is get money and fuck model bitches     russell simmons,all i wanna do be get money and fuck model bitch      russell simmons,wanna money fuck model bitch russell simmons,,,wanna money fuck model bitch russell simmons,14
3,0,3,0,1,"""@ARIZZLEINDACUT: Females think dating a pussy is cute now? http://t.co/VxBJg26Gsz"" how does doing this stuff make him a pussy?",mentionhere  females think dating a pussy is cute now  urlhere  how does doing this stuff make him a pussy,mentionhere   female think date a pussy be cute now   urlhere   how do do this stuff make -PRON- a pussy,mentionhere female pussy stuff pussy,,think date urlhere do make,mentionhere female pussy stuff pussy think date urlhere do make,22
3,1,2,0,1,"""@BeEasyJrizzy: u ever kill a ant on the sidewalk and think damn what if that nigga was on his way to get some pussy""No bs must b &gt;30%chance",mentionhere  u ever kill a ant on the sidewalk and think damn what if that nigga was on his way to get some pussy no bs must b  gt  chance,mentionhere   u ever kill a ant on the sidewalk and think damn what if that nigga be on -PRON- way to get some pussy no bs must b   gt   chance,mentionhere u ant sidewalk nigga way pussy gt chance,,kill think must b,mentionhere u ant sidewalk nigga way pussy gt chance kill think must b,33
3,2,1,0,0,"""@Blackman38Tide: @WhaleLookyHere @HowdyDowdy11 queer"" gaywad",mentionhere  mentionhere mentionhere queer  gaywad,mentionhere   mentionhere mentionhere queer   gaywad,mentionhere mentionhere mentionhere queer gaywad,,,mentionhere mentionhere mentionhere queer gaywad,7
3,0,3,0,1,"""@BrokenPiecesmsc: @ItsNotAdam faggot read my tweets after dat k"" it wasn't even funny lol",mentionhere  mentionhere faggot read my tweets after dat k  it wasn t even funny lol,mentionhere   mentionhere faggot read -PRON- tweet after dat k   -PRON- wasn t even funny lol,mentionhere mentionhere faggot tweet dat k wasn t lol,,read,mentionhere mentionhere faggot tweet dat k wasn t lol read,17
3,3,0,0,0,"""@CB_Baby24: @white_thunduh alsarabsss"" hes a beaner smh you can tell hes a mexican",mentionhere  mentionhere alsarabsss  hes a beaner smh you can tell hes a mexican,mentionhere   mentionhere alsarabsss   -PRON- s a beaner smh -PRON- can tell -PRON- s a mexican,mentionhere mentionhere alsarabsss beaner smh mexican,,s can tell s,mentionhere mentionhere alsarabsss beaner smh mexican s can tell s,17
3,1,2,0,1,"""@CaelanG15: ""@22EdHam: @CaelanG15 that nigga was eating that hoe lol"" Hell Yea lol john Paul"" nigga said john paul.. http://t.co/OSIpBKPr9h",mentionhere   mentionhere  mentionhere that nigga was eating that hoe lol  hell yea lol john paul  nigga said john paul   urlhere,mentionhere    mentionhere   mentionhere that nigga be eat that hoe lol   hell yea lol john paul   nigga say john paul    urlhere,mentionhere mentionhere mentionhere nigga hoe hell yea lol john paul nigga john paul,,eat say,mentionhere mentionhere mentionhere nigga hoe hell yea lol john paul nigga john paul eat say,25
3,0,3,0,1,"""@CauseWereGuys: On my way to fuck yo bitch http://t.co/j906T5zE2R"" me as a 9 year old",mentionhere  on my way to fuck yo bitch urlhere  me as a  year old,mentionhere   on -PRON- way to fuck yo bitch urlhere   -PRON- as a   year old,mentionhere way fuck yo bitch year,,,mentionhere way fuck yo bitch year,17
3,0,3,0,1,"""@CoryBandz: having one loyal female is wayyyyy better than having hoes , idc &#128175;""",mentionhere  having one loyal female is wayyyyy better than having hoes   idc,mentionhere   have one loyal female be wayyyyy well than have hoe    idc,mentionhere female hoe idc,,have wayyyyy have,mentionhere female hoe idc have wayyyyy have,14
3,3,0,0,0,"""@DevilGrimz: @VigxRArts you're fucking gay, blacklisted hoe"" Holding out for #TehGodClan anyway http://t.co/xUCcwoetmn",mentionhere  mentionhere you re fucking gay  blacklisted hoe  holding out for hashtaghere anyway urlhere,mentionhere   mentionhere -PRON- re fuck gay   blacklist hoe   hold out for hashtaghere anyway urlhere,mentionhere mentionhere hoe,,re fuck blacklist hold,mentionhere mentionhere hoe re fuck blacklist hold,17
3,0,3,0,1,"""@G27Status: I could go for a fat ass bitch on my lap"" same",mentionhere  i could go for a fat ass bitch on my lap  same,mentionhere   i could go for a fat ass bitch on -PRON- lap   same,mentionhere ass bitch lap,,could go,mentionhere ass bitch lap could go,15
6,0,6,0,1,"""@GTM_Al: Ya side bitch gotta know it's rules to this shit..anybody ask you my cousin from jersey thinkin bout moving"" lmmfao &#128514;&#128514;&#128514;&#128514;",mentionhere  ya side bitch gotta know it s rules to this shit  anybody ask you my cousin from jersey thinkin bout moving  lmmfao,mentionhere   ya side bitch get to know -PRON- s rule to this shit   anybody ask -PRON- -PRON- cousin from jersey thinkin bout move   lmmfao,mentionhere ya side bitch rule shit cousin jersey thinkin bout,,get know s ask move,mentionhere ya side bitch rule shit cousin jersey thinkin bout get know s ask move,27
3,1,2,0,1,"""@HoskinsTy96: White boy power bitch"" black power bitch",mentionhere  white boy power bitch  black power bitch,mentionhere   white boy power bitch   black power bitch,mentionhere white boy power bitch power bitch,,,mentionhere white boy power bitch power bitch,10
3,0,3,0,1,"""@LolaaIsDope: Lmao fucking snake bitches"" @ em",mentionhere  lmao fucking snake bitches    em,mentionhere   lmao fuck snake bitch     -PRON-,mentionhere lmao snake bitch,,fuck,mentionhere lmao snake bitch fuck,8
3,3,0,0,0,"""@MarkRoundtreeJr: LMFAOOOO I HATE BLACK PEOPLE https://t.co/RNvD2nLCDR"" This is why there's black people and niggers",mentionhere  lmfaoooo i hate black people urlhere  this is why there s black people and niggers,mentionhere   lmfaoooo i hate black people urlhere   this be why there s black people and nigger,mentionhere lmfaoooo people people nigger,,hate urlhere s,mentionhere lmfaoooo people people nigger hate urlhere s,18
3,2,1,0,0,"""@NoChillPaz: ""At least I'm not a nigger"" http://t.co/RGJa7CfoiT""

Lmfao",mentionhere   at least i m not a nigger  urlhere  lmfao,mentionhere    at least i m not a nigger   urlhere   lmfao,mentionhere nigger,,m,mentionhere nigger m,13
3,2,1,0,0,"""@NotoriousBM95: @_WhitePonyJr_ Ariza is a snake and a coward"" but at least he isn't a cripple like your hero Roach lmaoo",mentionhere  mentionhere ariza is a snake and a coward  but at least he isn t a cripple like your hero roach lmaoo,mentionhere   mentionhere ariza be a snake and a coward   but at least -PRON- isn t a cripple like -PRON- hero roach lmaoo,mentionhere mentionhere ariza snake isn cripple hero roach,,t,mentionhere mentionhere ariza snake isn cripple hero roach t,24
6,0,5,1,1,"""@OfficialReplay: I am lowkey tired."" ...if you tired, be quiet and go to sleep hoe!",mentionhere  i am lowkey tired      if you tired  be quiet and go to sleep hoe,mentionhere   i be lowkey tired       if -PRON- tire   be quiet and go to sleep hoe,mentionhere lowkey sleep hoe,,tire go,mentionhere lowkey sleep hoe tire go,18
6,3,2,1,0,"""@RTNBA: Drakes new shoes that will be released by Nike/Jordan.... Yes, there's glitter on the shoes http://t.co/QCtPLxHEXM"" ....dudes a fag",mentionhere  drakes new shoes that will be released by nike jordan     yes  there s glitter on the shoes urlhere      dudes a fag,mentionhere   drake new shoe that will be release by nike jordan      yes   there s glitter on the shoe urlhere       dude a fag,mentionhere shoe nike jordan glitter shoe fag,,drake will release s urlhere dude,mentionhere shoe nike jordan glitter shoe fag drake will release s urlhere dude,26
3,1,2,0,1,"""@RnadJorell: Bruh im tired of niggas retweetin Miley Cyrus naked that bitch aint no types of bad"" lmaooo",mentionhere  bruh im tired of niggas retweetin miley cyrus naked that bitch aint no types of bad  lmaooo,mentionhere   bruh -PRON- be tired of niggas retweetin miley cyrus nake that bitch be not no type of bad   lmaooo,mentionhere bruh niggas retweetin miley cyrus bitch type lmaooo,,be nake be,mentionhere bruh niggas retweetin miley cyrus bitch type lmaooo be nake be,22
3,1,2,0,1,"""@Samirahusic_: ""I don't want to have sex with my gf because I feel like I'm using her.."" - anonymous"" Whata faggot",mentionhere   i don t want to have sex with my gf because i feel like i m using her      anonymous  whata faggot,mentionhere    i don t want to have sex with -PRON- gf because i feel like i m use -PRON-       anonymous   whata faggot,mentionhere t sex gf whata faggot,,don want feel use,mentionhere t sex gf whata faggot don want feel use,25
3,0,3,0,1,"""@Shun_stokes: My cousin said he share hoes with his brothers. He said sharing is caring and he love his brothers &#128514;""",mentionhere  my cousin said he share hoes with his brothers  he said sharing is caring and he love his brothers,mentionhere   -PRON- cousin say -PRON- share hoe with -PRON- brother   -PRON- say share be care and -PRON- love -PRON- brother,mentionhere cousin share brother brother,,say hoe say share care love,mentionhere cousin share brother brother say hoe say share care love,22
3,2,1,0,0,"""@TheoMaxximus: #GerrysHalloweenParty http://t.co/3ycrSrnjHc"" Halloween was yesterday stupid nigger",mentionhere  hashtaghere urlhere  halloween was yesterday stupid nigger,mentionhere   hashtaghere urlhere   halloween be yesterday stupid nigger,mentionhere halloween yesterday nigger,,,mentionhere halloween yesterday nigger,10
3,0,3,0,1,"""@alejandra_p13: These bitches love Sosa""",mentionhere  these bitches love sosa,mentionhere   these bitch love sosa,mentionhere bitch sosa,,love,mentionhere bitch sosa love,6
3,2,1,0,0,"""@ashlingwilde: @ItsNotAdam is bored supposed to be cute, you faggot?"" Sometimes",mentionhere  mentionhere is bored supposed to be cute  you faggot   sometimes,mentionhere   mentionhere be bore suppose to be cute   -PRON- faggot    sometimes,mentionhere mentionhere,,bore suppose faggot,mentionhere mentionhere bore suppose faggot,14
3,2,1,0,0,"""@bigbootybishopp: @white_thunduh lassen cc , the coach wants me"" i feel it youll get more my nig no doubt",mentionhere  mentionhere lassen cc   the coach wants me  i feel it youll get more my nig no doubt,mentionhere   mentionhere lassen cc    the coach want -PRON-   i feel -PRON- -PRON- will get more -PRON- nig no doubt,mentionhere mentionhere lassen cc coach nig,,want feel will,mentionhere mentionhere lassen cc coach nig want feel will,22
3,0,3,0,1,"""@bleedingtrap: god teeth , gold chain
white bitches , cocaine""",mentionhere  god teeth   gold chain white bitches   cocaine,mentionhere   god tooth    gold chain white bitch    cocaine,mentionhere god tooth gold chain bitch cocaine,,,mentionhere god tooth gold chain bitch cocaine,11
3,1,2,0,1,"""@demi_eggleton: oh my god I love Victoria Mitchell"" all my bitches love me",mentionhere  oh my god i love victoria mitchell  all my bitches love me,mentionhere   oh my god i love victoria mitchell   all -PRON- bitch love -PRON-,mentionhere victoria mitchell bitch,,love love,mentionhere victoria mitchell bitch love love,15
3,0,3,0,1,"""@fatboyswagg347: they BAN dat pussy for life &amp; he gotta pay 2.5 millon dollar fine""",mentionhere  they ban dat pussy for life  amp  he gotta pay   millon dollar fine,mentionhere   -PRON- ban dat pussy for life   amp   -PRON- get to pay    millon dollar fine,mentionhere dat pussy life amp dollar fine,,ban get pay,mentionhere dat pussy life amp dollar fine ban get pay,19
3,0,3,0,1,"""@hazelebaby: Karma is a bitch #Damn #GodProtectsHisAngels &#128588;""

*sips tea*",mentionhere  karma is a bitch hashtaghere hashtaghere       sips tea,mentionhere   karma be a bitch hashtaghere hashtaghere        sip tea,mentionhere karma bitch tea,,sip,mentionhere karma bitch tea sip,11
3,0,3,0,1,"""@jaimescudi_: ""@Tonybthrz_: ""@jaimescudi_: I swear if oomf try talking to me tomorrow.."" @"" @BarackObama"" pussy",mentionhere   mentionhere   mentionhere  i swear if oomf try talking to me tomorrow       mentionhere  pussy,mentionhere    mentionhere    mentionhere   i swear if oomf try talk to -PRON- tomorrow        mentionhere   pussy,mentionhere mentionhere mentionhere oomf tomorrow mentionhere pussy,,swear try talk,mentionhere mentionhere mentionhere oomf tomorrow mentionhere pussy swear try talk,19
3,2,1,0,0,"""@jayswaggkillah: Jackies a retard #blondeproblems"" At least I can make a grilled cheese!",mentionhere  jackies a retard hashtaghere  at least i can make a grilled cheese,mentionhere   jackie a retard hashtaghere   at least i can make a grill cheese,mentionhere jackie retard cheese,,can make grill,mentionhere jackie retard cheese can make grill,15
3,2,1,0,0,"""@jgabsss: Stacey Dash won &#128166; http://t.co/PDLG46rjOL"" baddest bitch evaaaa",mentionhere  stacey dash won     urlhere  baddest bitch evaaaa,mentionhere   stacey dash win      urlhere   badd bitch evaaaa,mentionhere stacey dash bitch evaaaa,,win,mentionhere stacey dash bitch evaaaa win,11
3,0,3,0,1,"""@lildurk_: I don't trust dese hoes Nikki told 51st where I stay at all my fans screen shot ASAP"" we finna come to Chiraq and shoot sumn",mentionhere  i don t trust dese hoes nikki told st where i stay at all my fans screen shot asap  we finna come to chiraq and shoot sumn,mentionhere   i don t trust dese hoe nikki tell st where i stay at all -PRON- fan screen shoot asap   -PRON- finna come to chiraq and shoot sumn,mentionhere don t trust dese nikki st fan screen asap chiraq sumn,,hoe tell stay shoot come shoot,mentionhere don t trust dese nikki st fan screen asap chiraq sumn hoe tell stay shoot come shoot,30
3,0,3,0,1,"""@rugbysocklad: Helping out a mate!! http://t.co/eMNAdO1QOj"" I love scally play. Fuck yeah",mentionhere  helping out a mate   urlhere  i love scally play  fuck yeah,mentionhere   help out a mate    urlhere   i love scally play   fuck yeah,mentionhere mate fuck,,help love play,mentionhere mate fuck help love play,16
3,0,2,1,1,"""@soxandjox: Thick raw fuck http://t.co/g8RvUHCeBN"" Damn his man pussy is getting a workout.",mentionhere  thick raw fuck urlhere  damn his man pussy is getting a workout,mentionhere   thick raw fuck urlhere   damn -PRON- man pussy be get a workout,mentionhere fuck man workout,,damn get,mentionhere fuck man workout damn get,15
3,1,2,0,1,"""By the way we do punch bitches.""",by the way we do punch bitches,by the way -PRON- do punch bitch,way bitch,,punch,way bitch punch,7
3,2,1,0,0,"""Don't worry about the nigga you see, worry about the nigga you DON'T see... Dat's da nigga fuckin yo bitch.""",don t worry about the nigga you see  worry about the nigga you don t see    dat s da nigga fuckin yo bitch,don t worry about the nigga -PRON- see   worry about the nigga -PRON- don t see     dat s da nigga fuckin yo bitch,don t worry nigga nigga don t dat da nigga fuckin yo bitch,,see worry see,don t worry nigga nigga don t dat da nigga fuckin yo bitch see worry see,25
3,0,3,0,1,"""Get me that shit bitch you is fine bear""",get me that shit bitch you is fine bear,get -PRON- that shit bitch -PRON- be fine bear,shit bitch bear,,,shit bitch bear,9
3,3,0,0,0,"""Hey go look at that video of the man that found the kidnapped girls in Ohio........what a nigger"" - #shitmybosssays",hey go look at that video of the man that found the kidnapped girls in ohio        what a nigger    hashtaghere,hey go look at that video of the man that find the kidnap girl in ohio         what a nigger     hashtaghere,video man girl ohio nigger,,go look find kidnap,video man girl ohio nigger go look find kidnap,22
3,1,2,0,1,"""I KNOW my shoes dirty as fuck, whatever, bitch. You don't have to call!""

Like, negro... one of the first things they LOOK at is shoes, dog",i know my shoes dirty as fuck  whatever  bitch  you don t have to call   like  negro    one of the first things they look at is shoes  dog,i know -PRON- shoe dirty as fuck   whatever   bitch   -PRON- don t have to call    like   negro     one of the first thing -PRON- look at be shoe   dog,shoe bitch don t negro thing shoe dog,,know call look,shoe bitch don t negro thing shoe dog know call look,35
3,0,3,0,1,"""I said i don't like it, it tastes like wolf pussy"" 
""what? How do you even know what that tastes like""",i said i don t like it  it tastes like wolf pussy   what  how do you even know what that tastes like,i say i don t like -PRON-   -PRON- taste like wolf pussy    what   how do -PRON- even know what that taste like,t wolf pussy,,say don taste know taste,t wolf pussy say don taste know taste,25
3,1,2,0,1,"""I'm a funky ass honkey."" - @jtimberlake 's shout out to @macklemore tonight before ""Cabaret"" &#128514; #JT2020Tour",i m a funky ass honkey     mentionhere  s shout out to mentionhere tonight before  cabaret      hashtaghere,i m a funky ass honkey      mentionhere   s shout out to mentionhere tonight before   cabaret       hashtaghere,ass honkey mentionhere tonight cabaret,,m shout mentionhere,ass honkey mentionhere tonight cabaret m shout mentionhere,20
3,2,1,0,0,"""Let's kill cracker babies!"". WTF did I just hear???????? WOW.",let s kill cracker babies    wtf did i just hear         wow,let s kill cracker baby     wtf do i just hear          wow,cracker baby wtf,,let kill hear,cracker baby wtf let kill hear,13
3,0,3,0,1,"""Lmao @BlackBeauty515: &#128514;&#128514; RT @80sbaby4life: Pound cake look like pussy &#128514; http://t.co/UFYwCC9xCI""",lmao mentionhere         rt mentionhere  pound cake look like pussy     urlhere,lmao mentionhere          rt mentionhere   pound cake look like pussy      urlhere,lmao mentionhere rt mentionhere pound cake pussy,,look,lmao mentionhere rt mentionhere pound cake pussy look,13
3,2,1,0,0,"""My grandma used to call me a porch monkey all the time... Come to think of it she did refer to a broken bottle as a nigger knife"" &#128563;",my grandma used to call me a porch monkey all the time    come to think of it she did refer to a broken bottle as a nigger knife,#NAME?,grandma porch monkey time bottle nigger knife,,use call come think refer,grandma porch monkey time bottle nigger knife use call come think refer,29
3,2,1,0,0,"""Nah its You @NoMeek_JustMilz: &#128514;&#128514;&#128514;&#128514; yo i thought some1 photoshopped my face on that faggot smmfh...i hate yall"" http://t.co/5e2fkQ3Q2T",nah its you mentionhere               yo i thought some photoshopped my face on that faggot smmfh   i hate yall  urlhere,nah -PRON- -PRON- mentionhere                yo i think some photoshoppe -PRON- face on that faggot smmfh    i hate -PRON- all   urlhere,mentionhere yo face faggot smmfh,,think photoshoppe hate,mentionhere yo face faggot smmfh think photoshoppe hate,23
3,3,0,0,0,"""Our people"". Now is the time for the Aryan race 2 stand up and say ""no more"". Before the mongerls turn the world into a ghetto slum. 1488",our people   now is the time for the aryan race  stand up and say  no more   before the mongerls turn the world into a ghetto slum,#NAME?,people time race mongerl world ghetto slum,,stand say turn,people time race mongerl world ghetto slum stand say turn,30
3,0,3,0,1,"""SORRY JB FAN&#65292;REALLY JUSTIN COME BACK"". That is the top comment on a Justin Timberlake video with 10 million views. Son of a fucking bitch!",sorry jb fan   really justin come back   that is the top comment on a justin timberlake video with  million views  son of a fucking bitch,sorry jb fan    really justin come back    that be the top comment on a justin timberlake video with   million view   son of a fucking bitch,jb fan justin comment justin timberlake video view son bitch,,come,jb fan justin comment justin timberlake video view son bitch come,29
3,0,3,0,1,"""Shall I compare thee to a summer&#8217;s day? No, a summer&#8217;s day is not a bitch.""",shall i compare thee to a summer   s day  no  a summer   s day is not a bitch,shall i compare thee to a summer    s day   no   a summer    s day be not a bitch,summer s day summer s day bitch,,shall compare,summer s day summer s day bitch shall compare,22
3,0,3,0,1,"""She said wigga man you rich...take the du-rag off"" http://t.co/jb7J3zSbam",she said wigga man you rich   take the du rag off  urlhere,#NAME?,wigga man du,,say take rag,wigga man du say take rag,14
3,2,1,0,0,"""These sour apple bitter bitches, I'm not fuckin wit em""",these sour apple bitter bitches  i m not fuckin wit em,these sour apple bitter bitch   i m not fuckin wit -PRON-,apple bitch wit,,m fuckin,apple bitch wit m fuckin,12
4,0,4,0,1,"""They Faggots @JonnieSantana: Orioles petty as fuck...got swept up outta this bitch""",they faggots mentionhere  orioles petty as fuck   got swept up outta this bitch,#NAME?,orioles outta bitch,,faggot mentionhere get sweep,orioles outta bitch faggot mentionhere get sweep,15
3,1,2,0,1,"""U got my 200K bitch nigga""--Al Haymon to Antonio Tarver",u got my k bitch nigga   al haymon to antonio tarver,u get -PRON- k bitch nigga    al haymon to antonio tarver,u k bitch nigga al haymon,,get antonio,u k bitch nigga al haymon get antonio,12
3,3,0,0,0,"""We hate niggers, we hate faggots and we hate spics""-kkk rally",we hate niggers  we hate faggots and we hate spics  kkk rally,#NAME?,nigger faggot spic kkk rally,,hate hate hate,nigger faggot spic kkk rally hate hate hate,14
3,2,1,0,0,"""We're out here, and we're queer!""
"" 2, 4, 6, hut! We like it in our butt!""",we re out here  and we re queer           hut  we like it in our butt,#NAME?,queer hut butt,,re re like,queer hut butt re re like,18
3,2,1,0,0,"""Who the fuck you callin jiggaboo, nigga?!""",who the fuck you callin jiggaboo  nigga,who the fuck -PRON- callin jiggaboo   nigga,fuck jiggaboo nigga,,callin,fuck jiggaboo nigga callin,8
3,3,0,0,0,"""Why people think gay marriage is okay is beyond me. Sorry I don't want my future son seeing 2 fags walking down the street holding hands an",why people think gay marriage is okay is beyond me  sorry i don t want my future son seeing  fags walking down the street holding hands an,why people think gay marriage be okay be beyond -PRON-   sorry i don t want -PRON- future son see   fag walk down the street hold hand an,people marriage t son fag street hand,,think don want see walk hold,people marriage t son fag street hand think don want see walk hold,29
3,2,1,0,0,"""You ain't gunna do shit spear chucker""",you ain t gunna do shit spear chucker,#NAME?,t gunna shit spear chucker,,ain,t gunna shit spear chucker ain,8
3,0,2,1,1,"""You can take someone out of the ghetto, but you can't take the ghetto out of them.""",you can take someone out of the ghetto  but you can t take the ghetto out of them,-PRON- can take someone out of the ghetto   but -PRON- can t take the ghetto out of -PRON-,ghetto ghetto,,can take can take,ghetto ghetto can take can take,19
3,2,1,0,0,"""You ol trout mouth ass bitch"" 
DEEEEAAAADD",you ol trout mouth ass bitch  deeeeaaaadd,#NAME?,trout mouth ass bitch deeeeaaaadd,,old,trout mouth ass bitch deeeeaaaadd old,8
3,2,1,0,0,"""ayo i even kill handicapped and crippled bitches/look at my scalp real close and you'll see triple sixes""",ayo i even kill handicapped and crippled bitches look at my scalp real close and you ll see triple sixes,ayo i even kill handicapped and crippled bitch look at -PRON- scalp real close and -PRON- will see triple six,ayo bitch scalp six,,kill look will see,ayo bitch scalp six kill look will see,20
3,0,3,0,1,"""dont show me no bitch unless she look like Dolly Parton!!!""",dont show me no bitch unless she look like dolly parton,do not show -PRON- no bitch unless -PRON- look like dolly parton,bitch parton,,show look,bitch parton show look,12
3,2,1,0,0,"""fuck you you pussy ass hater go suck a dick and die quick"" - Someone, to me, in Youtube comments. I think we'd be good friends.",fuck you you pussy ass hater go suck a dick and die quick    someone  to me  in youtube comments  i think we d be good friends,fuck -PRON- -PRON- pussy ass hater go suck a dick and die quick     someone   to -PRON-   in youtube comment   i think -PRON- d be good friend,hater dick youtube comment friend,,pussy go suck die think be,hater dick youtube comment friend pussy go suck die think be,30
3,0,3,0,1,"""its britney bitch"" - the bible (leviticus 7:58) http://t.co/ZoAkn1ZlHm",its britney bitch    the bible  leviticus    urlhere,#NAME?,britney bitch bible leviticus,,,britney bitch bible leviticus,10
3,2,1,0,0,"""on my way to fuck your bitch in the name of The Lord"" - Mr. Race",on my way to fuck your bitch in the name of the lord    mr  race,on -PRON- way to fuck -PRON- bitch in the name of the lord     mr   race,way bitch name lord mr race,,fuck,way bitch name lord mr race fuck,17
3,2,1,0,0,"""poor whitey"" http://t.co/3UkKeyznz8",poor whitey  urlhere,poor whitey   urlhere,whitey,,,whitey,4
