count,hate_speech,offensive_language,neither,class,tweet,tweet_clean,tweet_lemma,tweet_nouns,tweet_sym,tweet_verbs,tweet_nv,num_tokens
3,0,3,0,1,"@_LezzzBeHonest 
Me bitch!",mentionhere me bitch,mentionhere -PRON- bitch,bitch,,mentionhere,bitch mentionhere,3
3,2,1,0,0,@_Nadiaxo fags,mentionhere fags,mentionhere fag,mentionhere fag,,,mentionhere fag,2
3,2,1,0,0,"@_SoulSurvivor_ @zakbauer I dont have any problems with zak, but you seem like a faggot http://t.co/NbFAArxvRP",mentionhere mentionhere i dont have any problems with zak  but you seem like a faggot urlhere,mentionhere mentionhere i do not have any problem with zak   but -PRON- seem like a faggot urlhere,mentionhere mentionhere problem zak faggot,,seem,mentionhere mentionhere problem zak faggot seem,18
3,0,3,0,1,@_TajMahal_ @_El_Padrino__ @AbellaXXX I'm lmao fa real cuz I really saw her throw dat bitch in a circle lol,mentionhere mentionhere mentionhere i m lmao fa real cuz i really saw her throw dat bitch in a circle lol,mentionhere mentionhere mentionhere i m lmao fa real cuz i really see -PRON- throw dat bitch in a circle lol,mentionhere mentionhere mentionhere i m lmao dat bitch circle lol,,see throw,mentionhere mentionhere mentionhere i m lmao dat bitch circle lol see throw,20
3,2,1,0,0,@_TriggaPlease_ @kanyewest he's a faggot,mentionhere mentionhere he s a faggot,mentionhere mentionhere -PRON- s a faggot,mentionhere mentionhere faggot,,s,mentionhere mentionhere faggot s,6
3,2,1,0,0,@_TurnDownDre @Jordan__Grimes @kushdaddycorr @TRob_waddUP that's true idk why your even in this convo you dumb nigger attention whore,mentionhere mentionhere mentionhere mentionhere that s true idk why your even in this convo you dumb nigger attention whore,mentionhere mentionhere mentionhere mentionhere that s true idk why -PRON- even in this convo -PRON- dumb nigger attention whore,mentionhere mentionhere mentionhere mentionhere idk convo nigger attention,,s,mentionhere mentionhere mentionhere mentionhere idk convo nigger attention s,19
3,2,1,0,0,@_TurnDownDre @kushdaddycorr lmao you stupid nigger,mentionhere mentionhere lmao you stupid nigger,mentionhere mentionhere lmao -PRON- stupid nigger,mentionhere mentionhere lmao nigger,,,mentionhere mentionhere lmao nigger,6
3,0,3,0,1,@_VIVMMXII yuhh I'm finna hit that hoe! &#128513;&#128077;,mentionhere yuhh i m finna hit that hoe,mentionhere yuhh i m finna hit that hoe,mentionhere yuhh i m finna hoe,,hit,mentionhere yuhh i m finna hoe hit,8
3,0,3,0,1,@_WORDtotheWISE how many times did you listen to that pussy song today?,mentionhere how many times did you listen to that pussy song today,mentionhere how many time do -PRON- listen to that pussy song today,mentionhere time song today,,listen,mentionhere time song today listen,12
3,2,1,0,0,@_XoXoKelsey_ hell naw fuck them bitches serves them right,mentionhere hell naw fuck them bitches serves them right,mentionhere hell naw fuck -PRON- bitch serve -PRON- right,mentionhere hell naw fuck bitch,,serve,mentionhere hell naw fuck bitch serve,9
3,2,1,0,0,@__Black_Jesus yea I forgot I was talkin to a degenerate faggot,mentionhere yea i forgot i was talkin to a degenerate faggot,mentionhere yea i forget i be talkin to a degenerate faggot,mentionhere yea degenerate faggot,,forget,mentionhere yea degenerate faggot forget,11
3,2,1,0,0,@_____0__o______ faggot,mentionhere faggot,mentionhere faggot,mentionhere faggot,,,mentionhere faggot,2
3,0,3,0,1,@___kd_ i need 2 of the bitches,mentionhere i need  of the bitches,mentionhere i need   of the bitch,mentionhere bitch,,need,mentionhere bitch need,7
3,0,3,0,1,"@__baabyshaay okaaaaay bitch never do we care , edges still laid. &#128514;",mentionhere okaaaaay bitch never do we care   edges still laid,mentionhere okaaaaay bitch never do -PRON- care    edge still lay,mentionhere okaaaaay bitch edge,,care lay,mentionhere okaaaaay bitch edge care lay,11
4,3,1,0,0,@__hannerr__ you're a faggot,mentionhere you re a faggot,mentionhere -PRON- re a faggot,mentionhere faggot,,re,mentionhere faggot re,5
3,2,1,0,0,@_angelaaau hey fag i &lt;3 you,mentionhere hey fag i  lt  you,mentionhere hey fag i   lt   -PRON-,mentionhere hey fag lt,,,mentionhere hey fag lt,8
3,0,3,0,1,@_bradleey SAME&#128530; like bitch it's the struggles to use the stairs let ppl get on &#128074;,mentionhere same    like bitch it s the struggles to use the stairs let ppl get on,mentionhere same     like bitch -PRON- s the struggle to use the stair let ppl get on,mentionhere bitch struggle stair ppl,,s use let,mentionhere bitch struggle stair ppl s use let,17
3,2,1,0,0,"@_cblaze @Barbod6FCB @ODDBEAST Man bitch am not gonna do a damn thang, if u don't like what I got to say then unfollow me",mentionhere mentionhere mentionhere man bitch am not gonna do a damn thang  if u don t like what i got to say then unfollow me,mentionhere mentionhere mentionhere man bitch be not go to do a damn thang   if u don t like what i get to say then unfollow -PRON-,mentionhere mentionhere mentionhere man bitch thang u don t,,go get say unfollow,mentionhere mentionhere mentionhere man bitch thang u don t go get say unfollow,27
3,0,3,0,1,@_chrisbrownn14 fuck bitches get money,mentionhere fuck bitches get money,mentionhere fuck bitch get money,mentionhere fuck bitch money,,get,mentionhere fuck bitch money get,5
3,3,0,0,0,@_elennamichelle nope not at all but I'm stuck in a house full of fucking niggers help me escape &#128553;,mentionhere nope not at all but i m stuck in a house full of fucking niggers help me escape,mentionhere nope not at all but i m stick in a house full of fucking nigger help -PRON- escape,mentionhere m house nigger,,nope stick help escape,mentionhere m house nigger nope stick help escape,19
3,2,1,0,0,@_jeff_hank @lgreiner3 @RayceWarden @BigJohn_Studd shut up nigger,mentionhere mentionhere mentionhere mentionhere shut up nigger,mentionhere mentionhere mentionhere mentionhere shut up nigger,mentionhere mentionhere mentionhere mentionhere nigger,,shut,mentionhere mentionhere mentionhere mentionhere nigger shut,7
3,2,1,0,0,@_n1k_nak Status Report: Making a pit stop in Canada to rape bitches,mentionhere status report  making a pit stop in canada to rape bitches,mentionhere status report   make a pit stop in canada to rape bitch,mentionhere status report pit stop canada bitch,,make rape,mentionhere status report pit stop canada bitch make rape,13
3,0,3,0,1,@_tiffanycarter bitch... Im mad at you for slapping me &#9995;,mentionhere bitch    im mad at you for slapping me,mentionhere bitch     -PRON- be mad at -PRON- for slap -PRON-,mentionhere bitch,,be slap,mentionhere bitch be slap,11
3,0,3,0,1,@_travvv's pussy. http://t.co/aXm9PCw95T,mentionhere s pussy  urlhere,mentionhere s pussy   urlhere,mentionhere s,,,mentionhere s,5
3,2,0,1,0,"@_westwest_yall @phampel WooHoo! New Black ""Kill Cracker babies"" Panthers to the rescue! #racist #trash #thugs #Ferguson #fergusonriot",mentionhere mentionhere woohoo  new black  kill cracker babies  panthers to the rescue  hashtaghere hashtaghere hashtaghere hashtaghere hashtaghere,mentionhere mentionhere woohoo   new black   kill cracker baby   panther to the rescue   hashtaghere hashtaghere hashtaghere hashtaghere hashtaghere,mentionhere mentionhere woohoo new cracker baby rescue hashtaghere hashtaghere,,kill panther,mentionhere mentionhere woohoo new cracker baby rescue hashtaghere hashtaghere kill panther,21
3,2,1,0,0,"@_womanoverboard ""nigger""",mentionhere  nigger,mentionhere   nigger,mentionhere nigger,,,mentionhere nigger,3
3,2,1,0,0,@aasthaxoxo oh shut your mouth i was talkin about the morning you fag,mentionhere oh shut your mouth i was talkin about the morning you fag,mentionhere oh shut -PRON- mouth i be talkin about the morning -PRON- fag,mentionhere mouth talkin morning,,shut fag,mentionhere mouth talkin morning shut fag,13
3,1,2,0,1,@ahimla2 - we do not want you here either! Suck my pigs arse you muzzie biotch! Get the phuck out and go back to your hellhole life!,mentionhere   we do not want you here either  suck my pigs arse you muzzie biotch  get the phuck out and go back to your hellhole life,mentionhere    -PRON- do not want -PRON- here either   suck -PRON- pig arse -PRON- muzzie biotch   get the phuck out and go back to -PRON- hellhole life,mentionhere pig phuck hellhole life,,want suck arse biotch go,mentionhere pig phuck hellhole life want suck arse biotch go,29
3,0,3,0,1,@alanaaaaaa_ why are you laughing . That's you hoe &#128514;,mentionhere why are you laughing   that s you hoe,mentionhere why be -PRON- laugh    that s -PRON- hoe,mentionhere,,laugh hoe,mentionhere laugh hoe,10
3,2,1,0,0,"@aldofelix naw dude I wish, they're white trash",mentionhere naw dude i wish  they re white trash,mentionhere naw dude i wish   -PRON- re white trash,mentionhere naw dude white trash,,wish re,mentionhere naw dude white trash wish re,10
3,2,1,0,0,@alexissert leave dyke,mentionhere leave dyke,mentionhere leave dyke,mentionhere leave dyke,,,mentionhere leave dyke,3
3,0,3,0,1,@alexrojas_10 pussy,mentionhere pussy,mentionhere pussy,mentionhere pussy,,,mentionhere pussy,2
3,2,1,0,0,@allsportsbruh you say waste a draft pick on Manziel when we have Mallet. that's why I'm telling you to delete your account. You're retarded,mentionhere you say waste a draft pick on manziel when we have mallet  that s why i m telling you to delete your account  you re retarded,mentionhere -PRON- say waste a draft pick on manziel when -PRON- have mallet   that s why i m tell -PRON- to delete -PRON- account   -PRON- re retarded,mentionhere draft pick manziel mallet account,,say waste s m tell delete re,mentionhere draft pick manziel mallet account say waste s m tell delete re,29
3,2,1,0,0,@alyssawiens faggot,mentionhere faggot,mentionhere faggot,mentionhere faggot,,,mentionhere faggot,2
3,2,1,0,0,@amandabynes i can give you some of my clothes so you can look like a cute dyke,mentionhere i can give you some of my clothes so you can look like a cute dyke,mentionhere i can give -PRON- some of -PRON- clothe so -PRON- can look like a cute dyke,mentionhere clothe dyke,,can give can look,mentionhere clothe dyke can give can look,17
3,2,1,0,0,@amarierubio chink eyed !,mentionhere chink eyed,mentionhere chink eyed,mentionhere chink eyed,,,mentionhere chink eyed,3
3,0,3,0,1,@anepicname only reason I wouldn't give it up is I ahve a fucking CATALOG on this bitch. Arcade games were fire.,mentionhere only reason i wouldn t give it up is i ahve a fucking catalog on this bitch  arcade games were fire,mentionhere only reason i wouldn t give -PRON- up be i ahve a fucking catalog on this bitch   arcade game be fire,mentionhere reason t catalog bitch arcade game fire,,wouldn give ahve,mentionhere reason t catalog bitch arcade game fire wouldn give ahve,23
3,2,1,0,0,"@aravosis May I jump in u ball-less dick-wad? As a conservative, feminist, disabled vet bitch, I wish u luck with a capital F. @DLoesch",mentionhere may i jump in u ball less dick wad  as a conservative  feminist  disabled vet bitch  i wish u luck with a capital f  mentionhere,mentionhere may i jump in u ball less dick wad   as a conservative   feminist   disabled vet bitch   i wish u luck with a capital f   mentionhere,mentionhere u ball dick wad feminist vet bitch u luck capital f mentionhere,,may jump wish,mentionhere u ball dick wad feminist vet bitch u luck capital f mentionhere may jump wish,31
3,0,3,0,1,@areuseriousrn @harmon_lauren it's okay I'll get bitches on this dick anyway but thanks for the tip,mentionhere mentionhere it s okay i ll get bitches on this dick anyway but thanks for the tip,mentionhere mentionhere -PRON- s okay i will get bitch on this dick anyway but thank for the tip,mentionhere mentionhere bitch dick thank tip,,s will,mentionhere mentionhere bitch dick thank tip s will,18
3,2,1,0,0,@ashhruggiero happy birthday queer,mentionhere happy birthday queer,mentionhere happy birthday queer,mentionhere happy birthday queer,,,mentionhere happy birthday queer,4
3,2,1,0,0,@asshole_king oh no. They drafted that gay ass that come out on TV? Well u welcome to Redskins nation. No queers just a lot of niggers.,mentionhere oh no  they drafted that gay ass that come out on tv  well u welcome to redskins nation  no queers just a lot of niggers,mentionhere oh no   -PRON- draft that gay ass that come out on tv   well u welcome to redskin nation   no queer just a lot of nigger,mentionhere ass tv redskin nation queer lot nigger,,draft come welcome,mentionhere ass tv redskin nation queer lot nigger draft come welcome,29
3,3,0,0,0,@asshole_king pats owner is a kike.,mentionhere pats owner is a kike,mentionhere pats owner be a kike,mentionhere pats owner kike,,,mentionhere pats owner kike,6
3,3,0,0,0,@asshole_king with pills that nig will last 4 years. Like magic j .That nig should hav died years ago. Y'all the first team to draft gay.,mentionhere with pills that nig will last  years  like magic j  that nig should hav died years ago  y all the first team to draft gay,mentionhere with pill that nig will last   year   like magic j   that nig should hav die year ago   y all the first team to draft gay,mentionhere pill nig year magic j nig year y team,,will last should hav die draft,mentionhere pill nig year magic j nig year y team will last should hav die draft,30
6,4,2,0,0,@atspace your 2. And 3. Nigga them hoes suck wayans brothers are not funny at all Jamie foxx should be number 2,mentionhere your   and   nigga them hoes suck wayans brothers are not funny at all jamie foxx should be number,mentionhere -PRON-    and    nigga -PRON- hoe suck wayans brother be not funny at all jamie foxx should be number,nigga wayans brother jamie foxx number,,mentionhere hoe suck should,nigga wayans brother jamie foxx number mentionhere hoe suck should,21
3,3,0,0,0,@austin_farrar your a fucking queer faggot bitch,mentionhere your a fucking queer faggot bitch,mentionhere -PRON- a fucking queer faggot bitch,queer faggot bitch,,mentionhere,queer faggot bitch mentionhere,7
3,0,3,0,1,@b_shiznitt fuck you bitch,mentionhere fuck you bitch,mentionhere fuck -PRON- bitch,mentionhere fuck,,bitch,mentionhere fuck bitch,4
3,0,3,0,1,@b_shiznitt what's good pussy,mentionhere what s good pussy,mentionhere what s good pussy,mentionhere pussy,,s,mentionhere pussy s,5
3,0,3,0,1,@baaaabyshaaaay_ Ununnnn what plans? Text me niggah!!,mentionhere ununnnn what plans  text me niggah,mentionhere ununnnn what plan   text -PRON- niggah,mentionhere ununnnn,,plan text,mentionhere ununnnn plan text,8
3,2,1,0,0,"@bad_boy_six @ksteven37 
Here ya go wetback, eat this.. http://t.co/kf6PgZvH5G",mentionhere mentionhere here ya go wetback  eat this   urlhere,mentionhere mentionhere here ya go wetback   eat this    urlhere,mentionhere mentionhere,,go eat,mentionhere mentionhere go eat,11
3,2,1,0,0,"@badshah200 Ur pal @STLAbuBadu threat2 ""apostate kufar""&gt;""I cld cut ur neck w/sword of islam &amp;watch u squeal like a bitch like Daniel Pearl""",mentionhere ur pal mentionhere threat  apostate kufar  gt  i cld cut ur neck w sword of islam  amp watch u squeal like a bitch like daniel pearl,mentionhere ur pal mentionhere threat   apostate kufar   gt   i cld cut ur neck w sword of islam   amp watch u squeal like a bitch like daniel pearl,mentionhere ur pal mentionhere threat apostate kufar gt ur neck w sword islam amp u squeal bitch daniel pearl,,cld cut watch,mentionhere ur pal mentionhere threat apostate kufar gt ur neck w sword islam amp u squeal bitch daniel pearl cld cut watch,31
3,2,0,1,0,@beesands10 But that's what you call white trash with money!!!!!,mentionhere but that s what you call white trash with money,mentionhere but that s what -PRON- call white trash with money,mentionhere trash money,,s call,mentionhere trash money s call,11
3,2,1,0,0,@bellaangeletti no ud still be a fag if I was lolz,mentionhere no ud still be a fag if i was lolz,mentionhere no ud still be a fag if i be lolz,mentionhere ud fag lolz,,,mentionhere ud fag lolz,11
3,2,1,0,0,@bellaangeletti ur a fag,mentionhere ur a fag,mentionhere ur a fag,mentionhere ur fag,,,mentionhere ur fag,4
3,2,1,0,0,@bitchdicknigga you're a fucking nigger,mentionhere you re a fucking nigger,mentionhere -PRON- re a fucking nigger,mentionhere nigger,,re,mentionhere nigger re,6
3,2,1,0,0,@bitchkrieg like the new AVI. My Twitter is retarded and shows you in the cubs hat but when I stalk your profile it show the new one,mentionhere like the new avi  my twitter is retarded and shows you in the cubs hat but when i stalk your profile it show the new one,mentionhere like the new avi   -PRON- twitter be retarded and show -PRON- in the cub hat but when i stalk -PRON- profile -PRON- show the new one,mentionhere avi twitter cub hat profile one,,show stalk show,mentionhere avi twitter cub hat profile one show stalk show,28
3,0,3,0,1,@bitchsides you're a bitch Ihy,mentionhere you re a bitch ihy,mentionhere -PRON- re a bitch ihy,mentionhere bitch ihy,,re,mentionhere bitch ihy re,6
3,0,2,1,1,@blastmccurdy in your dreams little leprechaun hemroid,mentionhere in your dreams little leprechaun hemroid,mentionhere in -PRON- dream little leprechaun hemroid,mentionhere dream hemroid,,,mentionhere dream hemroid,7
3,2,1,0,0,@bnp We are being overrun by mongrels because ZOG or the Jews that run our countries want the white man to perish.,mentionhere we are being overrun by mongrels because zog or the jews that run our countries want the white man to perish,mentionhere -PRON- be be overrun by mongrel because zog or the jews that run -PRON- country want the white man to perish,mentionhere overrun mongrel zog jews country man,,run want perish,mentionhere overrun mongrel zog jews country man run want perish,22
3,2,1,0,0,@bonnoxxx haha bitch ima draw a webb in bullets round yo fuggin forehead #BeamThat bitch i know where you reside,mentionhere haha bitch ima draw a webb in bullets round yo fuggin forehead hashtaghere bitch i know where you reside,mentionhere haha bitch -PRON- be going to draw a webb in bullet round yo fuggin forehead hashtaghere bitch i know where -PRON- reside,mentionhere haha bitch draw webb bullet yo fuggin forehead bitch,,be know reside,mentionhere haha bitch draw webb bullet yo fuggin forehead bitch be know reside,22
3,2,1,0,0,@bonnoxxx nah she said you a fag,mentionhere nah she said you a fag,mentionhere nah -PRON- say -PRON- a fag,mentionhere nah fag,,say,mentionhere nah fag say,7
3,0,3,0,1,@brookbristow @BigAssMoustache people gotta bitch about something.,mentionhere mentionhere people gotta bitch about something,mentionhere mentionhere people get to bitch about something,mentionhere mentionhere people,,get bitch,mentionhere mentionhere people get bitch,8
3,2,1,0,0,@brrrrangadang this nigga &#128529;&#128529;.. know damn well you a coon,mentionhere this nigga          know damn well you a coon,mentionhere this nigga           know damn well -PRON- a coon,mentionhere nigga coon,,know,mentionhere nigga coon know,10
3,2,1,0,0,@cambreezy_ @TheLittleFella_ she spelled faggots with an e you're so cool lol,mentionhere mentionhere she spelled faggots with an e you re so cool lol,mentionhere mentionhere -PRON- spell faggot with an e -PRON- re so cool lol,mentionhere mentionhere faggot e,,spell re,mentionhere mentionhere faggot e spell re,13
3,3,0,0,0,@caykelly16 @MadisonEarhart u guys are fags.,mentionhere mentionhere u guys are fags,mentionhere mentionhere u guy be fag,mentionhere mentionhere u guy fag,,,mentionhere mentionhere u guy fag,6
3,0,3,0,1,@cdnrod And they bitch cause police showed in force.They were the only thing preventing them from getting turned in2 road kill #I70Shutdown,mentionhere and they bitch cause police showed in force they were the only thing preventing them from getting turned in road kill hashtaghere,mentionhere and -PRON- bitch cause police show in force -PRON- be the only thing prevent -PRON- from get turn in road kill hashtaghere,mentionhere cause police force thing road kill,,bitch show prevent get turn,mentionhere cause police force thing road kill bitch show prevent get turn,23
3,2,1,0,0,@chanelisabeth that nigger music,mentionhere that nigger music,mentionhere that nigger music,nigger music,,mentionhere,nigger music mentionhere,4
3,0,3,0,1,@charlieecai ok!!!!! Stupid bitch,mentionhere ok      stupid bitch,mentionhere ok       stupid bitch,mentionhere ok bitch,,,mentionhere ok bitch,5
3,2,1,0,0,@chemicalkidss this bitch look like a fucking white trash Trailer park queen lookin man bear pig. http://t.co/fqyXLJYIET,mentionhere this bitch look like a fucking white trash trailer park queen lookin man bear pig  urlhere,mentionhere this bitch look like a fucking white trash trailer park queen lookin man bear pig   urlhere,bitch look trash trailer park queen lookin man bear pig,,mentionhere,bitch look trash trailer park queen lookin man bear pig mentionhere,18
3,1,2,0,1,@cj_menaa1 &#128553;&#128553;&#128514;&#128514; nigga doing the duggy on dem dead hoes lol,mentionhere              nigga doing the duggy on dem dead hoes lol,mentionhere               nigga do the duggy on dem dead hoe lol,mentionhere nigga duggy dem hoe,,do,mentionhere nigga duggy dem hoe do,11
3,0,3,0,1,@claire_ming get some orange hoe,mentionhere get some orange hoe,mentionhere get some orange hoe,mentionhere orange,,,mentionhere orange,5
9,5,0,4,0,"@clinchmtn316 @sixonesixband AMERICA today, the rule of thumb is: when in doubt, blame ""whitey""",mentionhere mentionhere america today  the rule of thumb is  when in doubt  blame  whitey,mentionhere mentionhere america today   the rule of thumb be   when in doubt   blame   whitey,mentionhere mentionhere america today rule thumb doubt blame whitey,,,mentionhere mentionhere america today rule thumb doubt blame whitey,18
3,2,1,0,0,@coffincreepxx you had to throw in the faggot word smh smh smh,mentionhere you had to throw in the faggot word smh smh smh,mentionhere -PRON- have to throw in the faggot word smh smh smh,mentionhere faggot word smh smh smh,,throw,mentionhere faggot word smh smh smh throw,12
3,0,3,0,1,@coolstorysam @MorgannnDee i thought you had some fucked up birth defect that made your nips heart shaped lmao.,mentionhere mentionhere i thought you had some fucked up birth defect that made your nips heart shaped lmao,mentionhere mentionhere i think -PRON- have some fuck up birth defect that make -PRON- nip heart shape lmao,mentionhere mentionhere birth defect nip heart lmao,,think fuck make shape,mentionhere mentionhere birth defect nip heart lmao think fuck make shape,18
3,2,1,0,0,"@coughlan616 Youre racist against white people whigger. Anti-Racist is a codeword for anti-white.
Anti-zionist is a codeword for antisemite.",mentionhere youre racist against white people whigger  anti racist is a codeword for anti white  anti zionist is a codeword for antisemite,mentionhere -PRON- be racist against white people whigger   anti racist be a codeword for anti white   anti zionist be a codeword for antisemite,mentionhere people anti racist codeword zionist codeword antisemite,,be whigger,mentionhere people anti racist codeword zionist codeword antisemite be whigger,25
3,0,3,0,1,"@cuunthiaaa @Fvnxy he's the ""fuck her right in the pussy"" guy",mentionhere mentionhere he s the  fuck her right in the pussy  guy,mentionhere mentionhere -PRON- s the   fuck -PRON- right in the pussy   guy,mentionhere mentionhere fuck guy,,s,mentionhere mentionhere fuck guy s,14
3,0,3,0,1,@dablueprint fuck no she dont let nobody hit that pussy either I know it's firm,mentionhere fuck no she dont let nobody hit that pussy either i know it s firm,mentionhere fuck no -PRON- do not let nobody hit that pussy either i know -PRON- s firm,mentionhere pussy,,let hit know s,mentionhere pussy let hit know s,17
3,2,1,0,0,@dantoomey2 fuck you faggot,mentionhere fuck you faggot,mentionhere fuck -PRON- faggot,mentionhere fuck,,faggot,mentionhere fuck faggot,4
3,2,1,0,0,@darthdanaa Yes you do retard.,mentionhere yes you do retard,mentionhere yes -PRON- do retard,mentionhere,,retard,mentionhere retard,5
3,0,3,0,1,"@datexehmm So bad bitches intimidate you, in other words?",mentionhere so bad bitches intimidate you  in other words,mentionhere so bad bitch intimidate -PRON-   in other word,mentionhere bitch word,,intimidate,mentionhere bitch word intimidate,10
6,4,2,0,0,@davidly62793584 how many fuckin fags did a even get? Shouldnt be allowed into my wallet whilst under the influence haha,mentionhere how many fuckin fags did a even get  shouldnt be allowed into my wallet whilst under the influence haha,mentionhere how many fuckin fag do a even get   should not be allow into -PRON- wallet whilst under the influence haha,mentionhere fuckin fag wallet influence,,should allow,mentionhere fuckin fag wallet influence should allow,22
6,0,6,0,1,"@davidlyon1690 @_shannonmacleod he wants pussy, nd a dini mean a cat",mentionhere mentionhere he wants pussy  nd a dini mean a cat,mentionhere mentionhere -PRON- want pussy   nd a dini mean a cat,mentionhere mentionhere pussy nd dini cat,,want mean,mentionhere mentionhere pussy nd dini cat want mean,12
3,2,1,0,0,@delaney_guinan a faggot that needs to grow up,mentionhere a faggot that needs to grow up,mentionhere a faggot that need to grow up,faggot,,mentionhere need grow,faggot mentionhere need grow,8
3,2,1,0,0,@delaney_guinan you did a good job doing that to me and not texting back faggot,mentionhere you did a good job doing that to me and not texting back faggot,mentionhere -PRON- do a good job do that to -PRON- and not texte back faggot,mentionhere job faggot,,do texte,mentionhere job faggot do texte,15
3,2,1,0,0,@deno_5 @kaitlyninst0ne you're reading you coon,mentionhere mentionhere you re reading you coon,mentionhere mentionhere -PRON- re read -PRON- coon,mentionhere mentionhere,,read,mentionhere mentionhere read,7
